300 Boston Scientific Way	Marlborough	01752-1234	United States	508 683 4000		https://www.bostonscientific.com	Medical Devices	medical-devices	Medical Devices	Healthcare	healthcare	Healthcare	Boston Scientific Corporation develops, manufactures, and markets medical devices for use in various interventional medical specialties worldwide. It operates through MedSurg and Cardiovascular segments. The company offers devices to diagnose and treat gastrointestinal and pulmonary conditions; devices to treat various urological and pelvic conditions; implantable cardioverter and implantable cardiac resynchronization therapy defibrillators; pacemakers and implantable cardiac resynchronization therapy pacemakers; and remote patient management systems. It also provides medical technologies to diagnose and treat rate and rhythm disorders of the heart comprising 3-D cardiac mapping and navigation solutions, ablation catheters, diagnostic catheters, mapping catheters, intracardiac ultrasound catheters, delivery sheaths, and other accessories; spinal cord stimulator systems for the management of chronic pain; indirect decompression systems; and deep brain stimulation systems. In addition, the company offers interventional cardiology products, that uses in the treatment of coronary artery disease and aortic valve conditions. Further, it provides stents, balloon catheters, guidewires, atherectomy, and thrombectomy systems to treat arterial and venous diseases; and peripheral embolization devices, radioactive microspheres, cryotherapy ablation systems, and micro and drainage catheters to treat cancer. The company was incorporated in 1979 and is headquartered in Marlborough, Massachusetts.	45000.0	[{'maxAge': 1, 'name': 'Mr. Michael F. Mahoney', 'age': 57, 'title': 'Chairman, President & CEO', 'yearBorn': 1965, 'fiscalYear': 2022, 'totalPay': 3766208, 'exercisedValue': 15775482, 'unexercisedValue': 39330292}, {'maxAge': 1, 'name': 'Mr. Daniel J. Brennan', 'age': 56, 'title': 'Executive VP & CFO', 'yearBorn': 1966, 'fiscalYear': 2022, 'totalPay': 1688305, 'exercisedValue': 1957916, 'unexercisedValue': 7260458}, {'maxAge': 1, 'name': 'Mr. Joseph M. Fitzgerald', 'age': 58, 'title': 'Executive VP & Group President of Cardiology', 'yearBorn': 1964, 'fiscalYear': 2022, 'totalPay': 1528356, 'exercisedValue': 3201473, 'unexercisedValue': 14532897}, {'maxAge': 1, 'name': 'Mr. Jeffrey B. Mirviss', 'age': 56, 'title': 'Executive VP & President of Peripheral Interventions', 'yearBorn': 1966, 'fiscalYear': 2022, 'totalPay': 1150080, 'exercisedValue': 977610, 'unexercisedValue': 3758294}, {'maxAge': 1, 'name': 'Mr. Arthur Crosswell  Butcher', 'age': 51, 'title': 'Executive VP and Group President of MedSurg & Asia Pacific', 'yearBorn': 1971, 'fiscalYear': 2022, 'totalPay': 1400850, 'exercisedValue': 155242, 'unexercisedValue': 2716173}, {'maxAge': 1, 'name': 'Mr. John Bradley Sorenson', 'age': 54, 'title': 'Executive Vice President of Global Operations', 'yearBorn': 1968, 'fiscalYear': 2022, 'exercisedValue': 0, 'unexercisedValue': 0}, {'maxAge': 1, 'name': 'Mr. Jonathan R Monson', 'title': 'Senior VP, Global Controller & Chief Accounting Officer', 'fiscalYear': 2022, 'exercisedValue': 0, 'unexercisedValue': 0}, {'maxAge': 1, 'name': 'Ms. Jodi Euerle Eddy', 'age': 49, 'title': 'Senior VP and Chief Information & Digital Officer', 'yearBorn': 1973, 'fiscalYear': 2022, 'exercisedValue': 0, 'unexercisedValue': 0}, {'maxAge': 1, 'name': 'Ms. Susan Vissers Lisa', 'age': 53, 'title': 'Vice President of Investor Relations', 'yearBorn': 1969, 'fiscalYear': 2022, 'exercisedValue': 0, 'unexercisedValue': 0}, {'maxAge': 1, 'name': 'Mr. Vance R. Brown', 'title': 'Senior VP, General Counsel & Corporate Secretary', 'fiscalYear': 2022, 'exercisedValue': 0, 'unexercisedValue': 0}]	10.0	9.0	7.0	8.0	9.0	1696118400.0	1672444800.0	86400	2	50.1	49.73	49.49	51.035	50.1	49.73	49.49	51.035		0.0194		0.0		0.769	84.1	22.526785	7349447	7349447	8242823	10018860	10018860	49.86	0.0	800.0	900.0	73884540928.0	39.52	55.38	5.5137715	52.237	50.63045	0.0	0.0	USD	83171704832.0	0.06806	1460386998.0	1464220032.0	0.00266	0.94181997	1464220032.0	12.461	4.049434	1672444800.0	1703980800.0	1688083200.0	0.038	861000000.0	0.6	2.24	1.99	2:1	1068076800.0	6.207	24.578	0.2319336	0.18349409			NYQ	EQUITY	BSX	BSX	Boston Scientific Corporation	Boston Scientific Corporation	706282200	America/New_York	EDT	69b49f65-05eb-36c8-ab80-d5db1263e17a	finmb_317627	-14400000	50.46	68.0	55.0	61.32	61.0	1.7	buy	28.0	426000000.0	0.291	3384000000.0	9454000128.0	0.561	1.29	13400000512.0	51.144	9.328	0.04224	0.05104	8679000000.0	1685624960.0	2124999936.0	0.059	0.109	0.69141996	0.25254	0.16837999	USD	1.5342	0.013008378035316077	0.206501599450568	US1011371077		MA	14575595.0	12223797.0	1693440000.0	1695945600.0	0.01	1.74	0.01									
2485 Augustine Drive	Santa Clara	95054	United States	408 749 4000		https://www.amd.com	Semiconductors	semiconductors	Semiconductors	Technology	technology	Technology	Advanced Micro Devices, Inc. operates as a semiconductor company worldwide. It operates in four segments: Data Center, Client, Gaming, and Embedded segments. The company offers x86 microprocessors and graphics processing units (GPUs) as an accelerated processing unit, chipsets, data center, and professional GPUs; and embedded processors, and semi-custom system-on-chip (SoC) products, microprocessor and SoC development services and technology, data processing unites, field programmable gate arrays (FPGA), and adaptive SoC products. It also provides processors under the AMD Ryzen, AMD Ryzen PRO, Ryzen Threadripper, Ryzen Threadripper PRO, AMD Athlon, AMD Athlon PRO, and AMD PRO A-Series brand names; graphics under the AMD Radeon graphics and AMD Embedded Radeon graphics; and professional graphics under the AMD Radeon Pro graphics brand name. In addition, the company offers data center graphics under the Radeon Instinct and Radeon PRO V-series brands, as well as servers under the AMD Instinct accelerators brand; server microprocessors under the AMD EPYC brands; embedded processor solutions under the AMD Athlon, AMD Geode, AMD Ryzen, AMD EPYC, AMD R-Series, and G-Series brands; FPGA products under the Virtex-6, Virtex-7, Virtex UltraScale+, Kintex-7, Kintex UltraScale, Kintex UltraScale+, Artix-7, Artix UltraScale+, Spartan-6, and Spartan-7 brands; adaptive SOCs under the Zynq-7000, Zynq UltraScale+ MPSoC, Zynq UltraScale+ RFSoCs, Versal HBM, Versal Premium, Versal Prime, Versal AI Core, Versal AI Edge, Vitis, and Vivado brands; and compute and network acceleration board products under the Alveo brand. It serves original equipment and design manufacturers, public cloud service providers, system integrators, independent distributors, online and brick and mortar retailers, and add-in-board manufacturers through its direct sales force, independent distributors, and sales representatives. The company was incorporated in 1969 and is headquartered in Santa Clara, California.	25000.0	[{'maxAge': 1, 'name': 'Dr. Lisa T. Su Ph.D.', 'age': 52, 'title': 'Chair & CEO', 'yearBorn': 1970, 'fiscalYear': 2022, 'totalPay': 2120679, 'exercisedValue': 61926388, 'unexercisedValue': 84294872}, {'maxAge': 1, 'name': 'Mr. Victor  Peng', 'age': 62, 'title': 'President', 'yearBorn': 1960, 'fiscalYear': 2022, 'totalPay': 6091409, 'exercisedValue': 0, 'unexercisedValue': 0}, {'maxAge': 1, 'name': 'Mr. Mark D. Papermaster', 'age': 60, 'title': 'CTO and Executive VP of Technology & Engineering', 'yearBorn': 1962, 'fiscalYear': 2022, 'totalPay': 1140933, 'exercisedValue': 4836541, 'unexercisedValue': 22460436}, {'maxAge': 1, 'name': 'Mr. Paul Darren Grasby', 'age': 52, 'title': 'Executive Vice President of Strategic Partnerships & President EMEA', 'yearBorn': 1970, 'fiscalYear': 2022, 'totalPay': 921473, 'exercisedValue': 1077205, 'unexercisedValue': 432646}, {'maxAge': 1, 'name': 'Ms. Jean X. Hu', 'age': 59, 'title': 'Executive VP, CFO & Treasurer', 'yearBorn': 1963, 'fiscalYear': 2022, 'exercisedValue': 0, 'unexercisedValue': 0}, {'maxAge': 1, 'name': 'Mr. Keivan  Keshvari', 'title': 'Senior Vice President of Global Operations', 'fiscalYear': 2022, 'exercisedValue': 0, 'unexercisedValue': 0}, {'maxAge': 1, 'name': 'Ms. Darla M. Smith', 'age': 56, 'title': 'Corporate VP & Chief Accounting Officer', 'yearBorn': 1966, 'fiscalYear': 2022, 'exercisedValue': 0, 'unexercisedValue': 0}, {'maxAge': 1, 'name': 'Mr. Hasmukh  Ranjan', 'title': 'Senior VP & Chief Information Officer', 'fiscalYear': 2022, 'exercisedValue': 0, 'unexercisedValue': 0}, {'maxAge': 1, 'name': 'Mr. Harry A. Wolin', 'age': 59, 'title': 'Senior VP, General Counsel & Corporate Secretary', 'yearBorn': 1963, 'fiscalYear': 2022, 'totalPay': 961942, 'exercisedValue': 9188269, 'unexercisedValue': 9460937}, {'maxAge': 1, 'name': 'Ms. Ruth  Cotter', 'title': 'Senior Vice President of Marketing, Communications & Human Resources', 'fiscalYear': 2022, 'exercisedValue': 0, 'unexercisedValue': 0}]	8.0	6.0	6.0	3.0	6.0	1696118400.0	1672444800.0	86400	2	106.46	103.54	101.6601	106.29	106.46	103.54	101.6601	106.29		0.0116	798940800.0	0.0		1.648		26.617722	49548255	49548255	59002525	52129060	52129060	0.0	0.0	800.0	800.0	169871540224.0	55.71	132.83	7.765201	105.1944	98.32215	0.0	0.0	USD	166446694400.0	-0.00114	1605638061.0	1615670016.0	0.00477	0.74466	1615670016.0	34.161	3.0777788	1672444800.0	1703980800.0	1688169600.0	-0.94	-25000000.0	-0.04	3.95	4.75	2:1	966902400.0	7.609	53.692	0.8371483	0.18349409			NMS	EQUITY	AMD	AMD	Advanced Micro Devices, Inc.	Advanced Micro Devices, Inc.	322151400	America/New_York	EDT	48af4341-f745-363f-945f-a838eeabb062	finmb_168864	-14400000	105.14	190.09	57.03	130.24	133.06	2.0	buy	38.0	6285000192.0	3.89	3100000000.0	2860000000.0	1.4	2.18	21876000768.0	5.187	13.554	-0.00349	-0.00045000002	12051000000.0	3586374912.0	2396999936.0	-0.938	-0.182	0.49967998	0.14171	-0.00373	USD	1.2038	0.03113828007549858	0.49430487200428075	US0079031078		CA	28964119.0	28178520.0	1693440000.0	1695945600.0	0.0179	0.55	0.018									
1600 Amphitheatre Parkway	Mountain View	94043	United States	650 253 0000		https://www.abc.xyz	Internet Content & Information	internet-content-information	Internet Content & Information	Communication Services	communication-services	Communication Services	Alphabet Inc. offers various products and platforms in the United States, Europe, the Middle East, Africa, the Asia-Pacific, Canada, and Latin America. It operates through Google Services, Google Cloud, and Other Bets segments. The Google Services segment provides products and services, including ads, Android, Chrome, hardware, Gmail, Google Drive, Google Maps, Google Photos, Google Play, Search, and YouTube. It is also involved in the sale of apps and in-app purchases and digital content in the Google Play store; and Fitbit wearable devices, Google Nest home products, Pixel phones, and other devices, as well as in the provision of YouTube non-advertising services. The Google Cloud segment offers infrastructure, cybersecurity, data, analytics, AI, and machine learning, and other services; Google Workspace that include cloud-based collaboration tools for enterprises, such as Gmail, Docs, Drive, Calendar, and Meet; and other services for enterprise customers. The Other Bets segment sells health technology and internet services. The company was founded in 1998 and is headquartered in Mountain View, California.	181798.0	"[{'maxAge': 1, 'name': 'Mr. Sundar  Pichai', 'age': 49, 'title': 'CEO & Director', 'yearBorn': 1973, 'fiscalYear': 2022, 'totalPay': 7947461, 'exercisedValue': 39618220, 'unexercisedValue': 0}, {'maxAge': 1, 'name': 'Ms. Ruth M. Porat', 'age': 64, 'title': 'President, Chief Investment Officer, Senior VP & CFO', 'yearBorn': 1958, 'fiscalYear': 2022, 'totalPay': 1790046, 'exercisedValue': 0, 'unexercisedValue': 0}, {'maxAge': 1, 'name': 'Mr. Lawrence Edward Page', 'age': 49, 'title': 'Co-Founder & Director', 'yearBorn': 1973, 'fiscalYear': 2022, 'totalPay': 1, 'exercisedValue': 0, 'unexercisedValue': 0}, {'maxAge': 1, 'name': 'Mr. Sergey  Brin', 'age': 48, 'title': 'Co-Founder & Director', 'yearBorn': 1974, 'fiscalYear': 2022, 'totalPay': 1, 'exercisedValue': 0, 'unexercisedValue': 0}, {'maxAge': 1, 'name': 'Mr. J. Kent Walker', 'age': 61, 'title': 'President of Global Affairs, Chief Legal Officer & Company Secretary', 'yearBorn': 1961, 'fiscalYear': 2022, 'totalPay': 1787541, 'exercisedValue': 0, 'unexercisedValue': 0}, {'maxAge': 1, 'name': 'Dr. Prabhakar  Raghavan', 'age': 61, 'title': 'Senior Vice President of Knowledge and Information - Google', 'yearBorn': 1961, 'fiscalYear': 2022, 'totalPay': 1785329, 'exercisedValue': 0, 'unexercisedValue': 0}, {'maxAge': 1, 'name': 'Mr. Philipp  Schindler', 'age': 51, 'title': 'Senior Vice President & Chief Business Officer of Google', 'yearBorn': 1971, 'fiscalYear': 2022, 'totalPay': 1785814, 'exercisedValue': 0, 'unexercisedValue': 0}, {'maxAge': 1, 'name': ""Ms. Amie Thuener O'Toole"", 'age': 47, 'title': 'Chief Accounting Officer & VP', 'yearBorn': 1975, 'fiscalYear': 2022, 'exercisedValue': 0, 'unexercisedValue': 0}, {'maxAge': 1, 'name': 'Ms. Ellen  West', 'title': 'Vice President of Investor Relations', 'fiscalYear': 2022, 'exercisedValue': 0, 'unexercisedValue': 0}, {'maxAge': 1, 'name': 'Ms. Fiona Clare Cicconi', 'age': 56, 'title': 'Chief People Officer', 'yearBorn': 1966, 'fiscalYear': 2022, 'exercisedValue': 0, 'unexercisedValue': 0}]"	8.0	6.0	10.0	10.0	10.0	1696118400.0	1672444800.0	86400	2	139.095	138.63	137.18	139.9	139.095	138.63	137.18	139.9		0.014099999		0.0		1.043	29.476795	20.822653	23117988	23117988	27577492	24730570	24730570	0.0	0.0	800.0	900.0	1769092677632.0	83.34	141.22	6.1102014	133.747	114.84585	0.0	0.0	USD	1672829468672.0	0.21052	10877910390.0	5933000192.0	0.0027700001	0.78931	12661699584.0	21.153	6.60521	1672444800.0	1703980800.0	1688083200.0	0.148	60953001984.0	4.74	6.71	1.29	20:1	1658102400.0	5.778	18.307	0.4023888	0.18349409			NMS	EQUITY	GOOGL	GOOGL	Alphabet Inc.	Alphabet Inc.	1092922200	America/New_York	EDT	e15ce71f-f533-3912-9f11-a46c09e2412b	finmb_29096	-14400000	139.72	200.0	126.0	151.14	150.0	1.9	buy	43.0	118331998208.0	9.385	91374002176.0	29432000512.0	2.022	2.172	289531002880.0	11.017	22.547	0.12961	0.23329	156633000000.0	68255125504.0	99142000640.0	0.191	0.071	0.55594003	0.31559	0.29273	USD	1.3262	0.021104331766487086	0.3350208806419518	US02079K3059		CA	42503885.0	49039430.0	1693440000.0	1695945600.0	0.0034	1.69	0.0072000003									
410 Terry Avenue North	Seattle	98109-5210	United States	206 266 1000		https://www.aboutamazon.com	Internet Retail	internet-retail	Internet Retail	Consumer Cyclical	consumer-cyclical	Consumer Cyclical	Amazon.com, Inc. engages in the retail sale of consumer products and subscriptions through online and physical stores in North America and internationally. It operates through three segments: North America, International, and Amazon Web Services (AWS). The company's products offered through its stores include merchandise and content purchased for resale; and products offered by third-party sellers. It also manufactures and sells electronic devices, including Kindle, Fire tablets, Fire TVs, Rings, Blink, eero, and Echo; and develops and produces media content. In addition, the company offers programs that enable sellers to sell their products in its stores; and programs that allow authors, musicians, filmmakers, Twitch streamers, skill and app developers, and others to publish and sell content. Further, it provides compute, storage, database, analytics, machine learning, and other services, as well as fulfillment, advertising, and digital content subscriptions. Additionally, the company offers Amazon Prime, a membership program. It serves consumers, sellers, developers, enterprises, content creators, and advertisers. The company was incorporated in 1994 and is headquartered in Seattle, Washington.	1541000.0	[{'maxAge': 1, 'name': 'Mr. Jeffrey P. Bezos', 'age': 58, 'title': 'Founder & Executive Chairman', 'yearBorn': 1964, 'fiscalYear': 2022, 'totalPay': 1681840, 'exercisedValue': 0, 'unexercisedValue': 0}, {'maxAge': 1, 'name': 'Mr. Andrew R. Jassy', 'age': 54, 'title': 'President, CEO & Director', 'yearBorn': 1968, 'fiscalYear': 2022, 'totalPay': 1298723, 'exercisedValue': 0, 'unexercisedValue': 0}, {'maxAge': 1, 'name': 'Mr. Brian T. Olsavsky', 'age': 58, 'title': 'Senior VP & CFO', 'yearBorn': 1964, 'fiscalYear': 2022, 'totalPay': 319850, 'exercisedValue': 0, 'unexercisedValue': 0}, {'maxAge': 1, 'name': 'Mr. David A. Zapolsky', 'age': 58, 'title': 'Senior VP of Global Public Policy & General Counsel', 'yearBorn': 1964, 'fiscalYear': 2022, 'totalPay': 319850, 'exercisedValue': 0, 'unexercisedValue': 0}, {'maxAge': 1, 'name': 'Mr. Douglas J. Herrington', 'age': 55, 'title': 'Chief Executive Officer of Worldwide Amazon Stores', 'yearBorn': 1967, 'fiscalYear': 2022, 'totalPay': 335438, 'exercisedValue': 0, 'unexercisedValue': 0}, {'maxAge': 1, 'name': 'Mr. Adam N. Selipsky', 'age': 55, 'title': 'Chief Executive Officer of Amazon Web Services, Inc.', 'yearBorn': 1967, 'fiscalYear': 2022, 'totalPay': 360613, 'exercisedValue': 0, 'unexercisedValue': 0}, {'maxAge': 1, 'name': 'Ms. Shelley L. Reynolds', 'age': 57, 'title': 'VP, Worldwide Controller & Principal Accounting Officer', 'yearBorn': 1965, 'fiscalYear': 2022, 'totalPay': 163200, 'exercisedValue': 0, 'unexercisedValue': 0}, {'maxAge': 1, 'name': 'Dr. Werner  Vogels', 'title': 'Chief Technology Officer', 'fiscalYear': 2022, 'exercisedValue': 0, 'unexercisedValue': 0}, {'maxAge': 1, 'name': 'Mr. Dave  Fildes', 'title': 'Director of Investor Relations', 'fiscalYear': 2022, 'exercisedValue': 0, 'unexercisedValue': 0}, {'maxAge': 1, 'name': 'Ms. Anuradha  Aggarwal', 'title': 'CMO & Director of User Growth', 'fiscalYear': 2022, 'exercisedValue': 0, 'unexercisedValue': 0}]	5.0	10.0	10.0	2.0	10.0	1696118400.0	1672444800.0	86400	2	132.55	130.39	128.71	132.58	132.55	130.39	128.71	132.58		0.0104		0.0		1.188	104.34127	44.265995	49281596	49281596	53176496	44581890	44581890	0.0	0.0	1300.0	3200.0	1356481298432.0	81.43	145.86	2.521125	134.1112	115.73395	0.0	0.0	USD	1466790707200.0	0.024300002	9042786330.0	10317800448.0	0.09718	0.60534	10402499584.0	16.348	8.041963	1672444800.0	1703980800.0	1688083200.0		13072000000.0	1.26	2.97	0.76	20:1	1654473600.0	2.726	23.124	0.14252198	0.18349409			NMS	EQUITY	AMZN	AMZN	Amazon.com, Inc.	Amazon.com, Inc.	863703000	America/New_York	EDT	261fd26b-0151-3813-b0d0-97e4ed4c6505	finmb_18749	-14400000	131.47	218.6	121.66	161.89	165.85	1.7	buy	46.0	63970000896.0	6.2	63431000064.0	174285996032.0	0.667	0.948	538046005248.0	103.371	52.562	0.02467	0.08715	225152000000.0	21140125696.0	61840998400.0		0.108	0.45529997	0.11788999	0.05716	USD	2.6044	0.023669758953010205	0.3757457746950575	US0231351067		WA	76818818.0	73378523.0	1693440000.0	1695945600.0	0.0074	1.41	0.0099									
One Apple Park Way	Cupertino	95014	United States	408 996 1010		https://www.apple.com	Consumer Electronics	consumer-electronics	Consumer Electronics	Technology	technology	Technology	Apple Inc. designs, manufactures, and markets smartphones, personal computers, tablets, wearables, and accessories worldwide. The company offers iPhone, a line of smartphones; Mac, a line of personal computers; iPad, a line of multi-purpose tablets; and wearables, home, and accessories comprising AirPods, Apple TV, Apple Watch, Beats products, and HomePod. It also provides AppleCare support and cloud services; and operates various platforms, including the App Store that allow customers to discover and download applications and digital content, such as books, music, video, games, and podcasts. In addition, the company offers various services, such as Apple Arcade, a game subscription service; Apple Fitness+, a personalized fitness service; Apple Music, which offers users a curated listening experience with on-demand radio stations; Apple News+, a subscription news and magazine service; Apple TV+, which offers exclusive original content; Apple Card, a co-branded credit card; and Apple Pay, a cashless payment service, as well as licenses its intellectual property. The company serves consumers, and small and mid-sized businesses; and the education, enterprise, and government markets. It distributes third-party applications for its products through the App Store. The company also sells its products through its retail and online stores, and direct sales force; and third-party cellular network carriers, wholesalers, retailers, and resellers. Apple Inc. was incorporated in 1977 and is headquartered in Cupertino, California.	164000.0	"[{'maxAge': 1, 'name': 'Mr. Timothy D. Cook', 'age': 61, 'title': 'CEO & Director', 'yearBorn': 1961, 'fiscalYear': 2022, 'totalPay': 16425933, 'exercisedValue': 0, 'unexercisedValue': 0}, {'maxAge': 1, 'name': 'Mr. Luca  Maestri', 'age': 59, 'title': 'CFO & Senior VP', 'yearBorn': 1963, 'fiscalYear': 2022, 'totalPay': 5019783, 'exercisedValue': 0, 'unexercisedValue': 0}, {'maxAge': 1, 'name': 'Mr. Jeffrey E. Williams', 'age': 58, 'title': 'Chief Operating Officer', 'yearBorn': 1964, 'fiscalYear': 2022, 'totalPay': 5018337, 'exercisedValue': 0, 'unexercisedValue': 0}, {'maxAge': 1, 'name': 'Ms. Katherine L. Adams', 'age': 58, 'title': 'Senior VP, General Counsel & Secretary', 'yearBorn': 1964, 'fiscalYear': 2022, 'totalPay': 5015208, 'exercisedValue': 0, 'unexercisedValue': 0}, {'maxAge': 1, 'name': ""Ms. Deirdre  O'Brien"", 'age': 55, 'title': 'Senior Vice President of Retail', 'yearBorn': 1967, 'fiscalYear': 2022, 'totalPay': 5019783, 'exercisedValue': 0, 'unexercisedValue': 0}, {'maxAge': 1, 'name': 'Mr. Chris  Kondo', 'title': 'Senior Director of Corporate Accounting', 'fiscalYear': 2022, 'exercisedValue': 0, 'unexercisedValue': 0}, {'maxAge': 1, 'name': 'Mr. James  Wilson', 'title': 'Chief Technology Officer', 'fiscalYear': 2022, 'exercisedValue': 0, 'unexercisedValue': 0}, {'maxAge': 1, 'name': 'Ms. Mary  Demby', 'title': 'Chief Information Officer', 'fiscalYear': 2022, 'exercisedValue': 0, 'unexercisedValue': 0}, {'maxAge': 1, 'name': 'Ms. Nancy  Paxton', 'title': 'Senior Director of Investor Relations & Treasury', 'fiscalYear': 2022, 'exercisedValue': 0, 'unexercisedValue': 0}, {'maxAge': 1, 'name': 'Mr. Greg  Joswiak', 'title': 'Senior Vice President of Worldwide Marketing', 'fiscalYear': 2022, 'exercisedValue': 0, 'unexercisedValue': 0}]"	4.0	1.0	5.0	1.0	1.0	1696118400.0	1672444800.0	86400	2	178.72	176.645	174.8	178.42	178.72	176.645	174.8	178.42	0.96	0.0054	1691712000.0	0.156	0.85	1.308	29.77311	28.434992	55881270	55881270	58579918	51061480	51061480	0.0	0.0	900.0	1000.0	2769598283776.0	124.17	198.23	7.213754	177.792	168.79825	0.93	0.0052036704	USD	2816402259968.0	0.24681	15617034345.0	15634199552.0	0.00071999995	0.61317	15634199552.0	3.852	45.989094	1663977600.0	1695513600.0	1688169600.0	0.023	94760001536.0	5.95	6.23	4.41	4:1	1598832000.0	7.336	22.721	0.2314055	0.18349409	0.24	1691712000.0	NMS	EQUITY	AAPL	AAPL	Apple Inc.	Apple Inc.	345479400	America/New_York	EDT	8b10e4ae-9eeb-3684-921a-9ab27e4d87aa	finmb_24937	-14400000	177.15	228.1	141.61	189.53	190.09	2.0	buy	36.0	62482001920.0	3.996	123957002240.0	109280002048.0	0.814	0.982	383932989440.0	181.305	24.22	0.20896	1.60093	170782000000.0	90680500224.0	113071996928.0	0.05	-0.014	0.43449003	0.32286	0.28116	USD	2.2666	0.016719716974841415	0.2654172786408934	US0378331005		CA	94725628.0	102091714.0	1693440000.0	1695945600.0	0.0061000003	1.44	0.0061000003									
