address1	city	zip	country	phone	fax	website	industry	industryKey	industryDisp	sector	sectorKey	sectorDisp	longBusinessSummary	fullTimeEmployees	companyOfficers	auditRisk	boardRisk	compensationRisk	shareHolderRightsRisk	overallRisk	governanceEpochDate	compensationAsOfEpochDate	maxAge	priceHint	previousClose	open	dayLow	dayHigh	regularMarketPreviousClose	regularMarketOpen	regularMarketDayLow	regularMarketDayHigh	dividendRate	dividendYield	exDividendDate	payoutRatio	fiveYearAvgDividendYield	beta	trailingPE	forwardPE	volume	regularMarketVolume	averageVolume	averageVolume10days	averageDailyVolume10Day	bid	ask	bidSize	askSize	marketCap	fiftyTwoWeekLow	fiftyTwoWeekHigh	priceToSalesTrailing12Months	fiftyDayAverage	twoHundredDayAverage	trailingAnnualDividendRate	trailingAnnualDividendYield	currency	enterpriseValue	profitMargins	floatShares	sharesOutstanding	heldPercentInsiders	heldPercentInstitutions	impliedSharesOutstanding	bookValue	priceToBook	lastFiscalYearEnd	nextFiscalYearEnd	mostRecentQuarter	earningsQuarterlyGrowth	netIncomeToCommon	trailingEps	forwardEps	pegRatio	lastSplitFactor	lastSplitDate	enterpriseToRevenue	enterpriseToEbitda	52WeekChange	SandP52WeekChange	lastDividendValue	lastDividendDate	exchange	quoteType	symbol	underlyingSymbol	shortName	longName	firstTradeDateEpochUtc	timeZoneFullName	timeZoneShortName	uuid	messageBoardId	gmtOffSetMilliseconds	currentPrice	targetHighPrice	targetLowPrice	targetMeanPrice	targetMedianPrice	recommendationMean	recommendationKey	numberOfAnalystOpinions	totalCash	totalCashPerShare	ebitda	totalDebt	quickRatio	currentRatio	totalRevenue	debtToEquity	revenuePerShare	returnOnAssets	returnOnEquity	grossProfits	freeCashflow	operatingCashflow	earningsGrowth	revenueGrowth	grossMargins	ebitdaMargins	operatingMargins	financialCurrency	trailingPegRatio	Volatility	Annual Volatility	ISIN	address2	state	sharesShort	sharesShortPriorMonth	sharesShortPreviousMonthDate	dateShortInterest	sharesPercentSharesOut	shortRatio	shortPercentOfFloat	totalAssets	navPrice	beta3Year	fundFamily	fundInceptionDate	legalType	yield	ytdReturn	threeYearAverageReturn
Affolternstrasse 44	Zurich	8050	Switzerland	41 43 317 71 11	41 43 317 43 43	https://global.abb/group/en	Electrical Equipment & Parts	electrical-equipment-parts	Electrical Equipment & Parts	Industrials	industrials	Industrials	ABB Ltd manufactures and sells electrification, automation, robotics, and motion products for customers in utilities, industry and transport, and infrastructure in Switzerland and internationally. Its Electrification segment provides electric vehicle charging infrastructure, renewable power solutions, modular substation packages, distribution automation products, switchboards and panel boards, switchgears, UPS solutions, circuit breakers, measuring and sensing devices, control products, wiring accessories, enclosures and cabling systems, and intelligent home and building solutions. The company's Robotics & Discrete Automation segment offers industrial robots, software, autonomous mobile robotics, robotic solutions, field services, spare parts, and digital services. This segment also provides solutions based on its programmable logic controllers, industrial PCs, servo motion, transport systems, and machine vision. Its Motion segment designs, manufactures, and sells drives, motors, generators, and traction converters that are driving the low-carbon future for industries, cities, infrastructure, and transportation. The company's Process Automation segment develops and sells control technologies, advanced process control software and manufacturing execution systems, sensing, measurement and analytical instrumentation, marine propulsion systems, and turbochargers. This segment also offers remote monitoring, preventive maintenance, asset performance management, emission monitoring, and cybersecurity services. It serves aluminum, automotive, battery manufacturing, buildings and infrastructure, cement, channel partners, chemical, data centers, food and beverage, process automation, life sciences, ports, marine, mining, oil and gas, ports, power generation, printing, pulp and paper, railway, smart cities, water, and wind power industries. The company was founded in 1883 and is headquartered in Zurich, Switzerland.	104720.0	[{'maxAge': 1, 'name': 'Mr. Bjorn Klas Otto Rosengren', 'age': 63, 'title': 'Chief Exec. Officer', 'yearBorn': 1959, 'fiscalYear': 2022, 'totalPay': 5663402, 'exercisedValue': 0, 'unexercisedValue': 0}, {'maxAge': 1, 'name': 'Mr. Timo J. Ihamuotila', 'age': 56, 'title': 'Chief Financial Officer', 'yearBorn': 1966, 'fiscalYear': 2022, 'totalPay': 3423273, 'exercisedValue': 0, 'unexercisedValue': 0}, {'maxAge': 1, 'name': 'Mr. Andrea  Antonelli', 'age': 48, 'title': 'Gen. Counsel & Company Sec.', 'yearBorn': 1974, 'fiscalYear': 2022, 'totalPay': 1814752, 'exercisedValue': 0, 'unexercisedValue': 0}, {'maxAge': 1, 'name': 'Ms. Karin  Lepasoon L.L.M.', 'age': 54, 'title': 'Chief Communications & Sustainability Officer', 'yearBorn': 1968, 'fiscalYear': 2022, 'totalPay': 866347, 'exercisedValue': 0, 'unexercisedValue': 0}, {'maxAge': 1, 'name': 'Ms. Carolina Yvonne Granat', 'age': 50, 'title': 'Chief HR Officer', 'yearBorn': 1972, 'fiscalYear': 2022, 'totalPay': 2371594, 'exercisedValue': 0, 'unexercisedValue': 0}, {'maxAge': 1, 'name': 'Dr. Peter  Terwiesch', 'age': 56, 'title': 'Pres of Process Automation', 'yearBorn': 1966, 'fiscalYear': 2022, 'totalPay': 3092105, 'exercisedValue': 0, 'unexercisedValue': 0}, {'maxAge': 1, 'name': 'Mr. Tarak  Mehta', 'age': 56, 'title': 'Pres of Motion Bus. Area', 'yearBorn': 1966, 'fiscalYear': 2022, 'totalPay': 3385393, 'exercisedValue': 0, 'unexercisedValue': 0}, {'maxAge': 1, 'name': 'Dr. Sami  Atiya', 'age': 58, 'title': 'Pres of Robotics & Discrete Automation Bus.', 'yearBorn': 1964, 'fiscalYear': 2022, 'totalPay': 2426450, 'exercisedValue': 0, 'unexercisedValue': 0}, {'maxAge': 1, 'name': 'Mr. Morten  Wierod', 'age': 50, 'title': 'Pres of Electrification Bus. Area', 'yearBorn': 1972, 'fiscalYear': 2022, 'totalPay': 2937750, 'exercisedValue': 0, 'unexercisedValue': 0}, {'maxAge': 1, 'name': 'Mr. Alec  Joannou', 'title': 'Chief Information Officer', 'exercisedValue': 0, 'unexercisedValue': 0}]	10.0	1.0	1.0	1.0	2.0	1696118400.0	1672444800.0	86400	2	32.66	31.4	30.51	31.49	32.66	31.4	30.51	31.49	0.84	0.0257	1679875200.0	0.4998	3.23	0.956073	18.620481	19.687897	2713407	2713407	2742784	2751736	2751736	30.88	30.89	0.0	0.0	57365561344.0	26.2	35.74	1.8355805	32.9954	32.573	0.908	0.027801592	CHF	66766598144.0	0.10988	1591564800.0	1854009984.0	0.00044	0.55821997	1855890048.0	6.88	4.4927325	1672444800.0	1703980800.0	1688083200.0	1.391	3465999872.0	1.66	1.57	3.29	4:1	989193600.0	2.136	12.837	0.2204783	0.18349409	0.84	1679875200.0	EBS	EQUITY	ABBN.SW	ABBN.SW	ABB LTD N	ABB Ltd	930553200	Europe/Zurich	CEST	c4dc1a8d-e9ff-3829-8756-cb48c130b200	finmb_18527	7200000	30.91	39.22	24.52	29.59	27.94	2.6	hold	21.0	4118000128.0	2.214	5200999936.0	9504000000.0	0.699	1.136	31252000768.0	70.772	16.726	0.07093	0.27477	9734000000.0	1129250048.0	2520000000.0	1.491	0.126	0.34459	0.16642	0.143	USD	1.2728	0.01312684571579851	0.2083822155762991	CH0012221716																		
Chemin de Blandonnet 8	Geneva	1214	Switzerland	1 817 293 0450	1 817 916 2652	https://www.alcon.com	Medical Instruments & Supplies	medical-instruments-supplies	Medical Instruments & Supplies	Healthcare	healthcare	Healthcare	Alcon Inc. researches, develops, manufactures, distributes, and sells eye care products for eye care professionals and their patients worldwide. The company's Surgical segment offers equipment, instrumentation and diagnostics, intraocular lenses (IOLs), and other implantables; and consumables, including viscoelastics, surgical solutions, incisional instruments, surgical custom packs, and other products for use in surgical procedures. Its cataract products include centurion vision system, LenSx laser system, LuxOR surgical ophthalmic microscope, NGENUITY 3D visualization system, and ORA system for intra-operative measurements; custom pak surgical procedure packs; vitreoretinal products comprising constellation vision systems, procedure packs, lasers and hand-held microsurgical instruments, and grieshaber and MIVS instruments, as well as scissors, forceps and micro-instruments, medical grade vitreous tamponades, and Hypervit vitrectomy probes; refractive surgery products, including WaveLight lasers and Contoura Vision used for LASIK treatment; EX-PRESS glaucoma filtration device; and implantables products, including AcrySof IQ products, such as monofocal IOLs and advanced technology IOLs for the correction of presbyopia and astigmatism at the time of cataract surgery. Its Vision Care segment provides daily disposable, reusable, and color-enhancing contact lenses; ocular health products, such as dry eye, glaucoma, contact lens care, and ocular allergies; and ocular vitamins and redness relievers. The company was formerly known as Alcon Universal S.A. and changed the name to Alcon Inc. in December 2001. Alcon Inc. was founded in 1945 and is headquartered in Geneva, Switzerland.	25000.0	[{'maxAge': 1, 'name': 'Mr. F. Michael Ball', 'age': 67, 'title': 'Exec. Chairman', 'yearBorn': 1955, 'fiscalYear': 2022, 'totalPay': 994816, 'exercisedValue': 0, 'unexercisedValue': 0}, {'maxAge': 1, 'name': 'Mr. David J. Endicott', 'age': 57, 'title': 'CEO & Director', 'yearBorn': 1965, 'fiscalYear': 2022, 'totalPay': 4824094, 'exercisedValue': 0, 'unexercisedValue': 0}, {'maxAge': 1, 'name': 'Mr. Arthur B. Cummings M.D.', 'age': 60, 'title': 'Exec. Director', 'yearBorn': 1962, 'fiscalYear': 2022, 'totalPay': 257539, 'exercisedValue': 0, 'unexercisedValue': 0}, {'maxAge': 1, 'name': 'Mr. Timothy C. Stonesifer', 'age': 55, 'title': 'Chief Financial Officer', 'yearBorn': 1967, 'exercisedValue': 0, 'unexercisedValue': 0}, {'maxAge': 1, 'name': 'Margaret  Buckley', 'title': 'Chief Accounting Officer', 'exercisedValue': 0, 'unexercisedValue': 0}, {'maxAge': 1, 'name': 'Dr. Franck  Leveiller', 'title': 'Sr. VP, Head of Global R&D and Chief Scientific Officer', 'exercisedValue': 0, 'unexercisedValue': 0}, {'maxAge': 1, 'name': 'Ms. Sue-Jean  Lin', 'age': 63, 'title': 'Sr. VP & Chief Information and Transformation Officer', 'yearBorn': 1959, 'exercisedValue': 0, 'unexercisedValue': 0}, {'maxAge': 1, 'name': 'Mr. Royce R. Bedward', 'age': 56, 'title': 'Sr. VP, Gen. Counsel & Corp. Sec.', 'yearBorn': 1966, 'exercisedValue': 0, 'unexercisedValue': 0}, {'maxAge': 1, 'name': 'Mr. Laurent  Attias', 'age': 54, 'title': 'Head of Corp. Devel., Strategy, BD&L and M&A', 'yearBorn': 1968, 'exercisedValue': 0, 'unexercisedValue': 0}, {'maxAge': 1, 'name': 'Ms. Kimberly  Martin', 'age': 47, 'title': 'Sr. VP & Chief HR Officer', 'yearBorn': 1975, 'exercisedValue': 0, 'unexercisedValue': 0}]	6.0	3.0	1.0	1.0	2.0	1696118400.0	1672444800.0	86400	2	67.62	67.22	66.22	67.22	67.62	67.22	66.22	67.22	0.21	0.0031	1683676800.0	0.3174		0.684096	100.81818	23.429579	120495	120495	661519	708484	708484	66.54	66.6	0.0	0.0	33217966080.0	56.4	75.4	3.656353	71.6576	69.16	0.227	0.0033569948	CHF	37788422144.0	0.03985	492636486.0	491800000.0	0.00068000006	0.6199	499217984.0	40.436	1.6455634	1672444800.0	1703980800.0	1688083200.0	0.142	362000000.0	0.66	2.84	1.97			4.159	19.095	0.1492182	0.18349409	0.21	1683676800.0	EBS	EQUITY	ALC.SW	ALC.SW	ALCON N	Alcon Inc.	1554706800	Europe/Zurich	CEST	e470530a-8feb-3311-a62e-befaf3747b20	finmb_694234	7200000	66.54	98.06	69.04	83.07	82.13	2.0	buy	15.0	662000000.0	1.343	1979000064.0	5106999808.0	1.153	2.161	9084999680.0	25.613	18.46	0.01888	0.018339999	4807000000.0	462875008.0	1156999936.0	0.133	0.092	0.55157	0.21783	0.09466	USD	2.1135	0.014172781672760903	0.2249859341528362	CH0432492467	Vernier																	
Schachenstrasse 77	Rapperswil-Jona	8645	Switzerland	41 55 221 63 00	41 55 221 67 47	https://www.geberit.com	Building Products & Equipment	building-products-equipment	Building Products & Equipment	Industrials	industrials	Industrials	Geberit AG develops, produces, and distributes sanitary products and systems for the residential and commercial construction industry in Switzerland and internationally. The company offers installation and flushing systems, such as installation technology and flushing systems for toilets, including cisterns and fittings; and piping systems consisting of building drainage and supply systems, as well as piping technology for use in buildings for drinking water, heating, gas, and other media. It also provides bathroom systems product comprising bathroom ceramics, furniture, showers, bathtubs, taps and controls, and shower toilets. The company sells its products under the Geberit brand name. It sells its products to wholesalers, plumbers, architects, and sanitary engineers. Geberit AG was founded in 1874 and is headquartered in Rapperswil-Jona, Switzerland.	11183.0	[{'maxAge': 1, 'name': 'Dr. Christian  Buhl', 'age': 49, 'title': 'Chairman of the Group Exec. Board & CEO', 'yearBorn': 1973, 'fiscalYear': 2022, 'totalPay': 1947376, 'exercisedValue': 0, 'unexercisedValue': 0}, {'maxAge': 1, 'name': 'Mr. Tobias  Knechtle', 'age': 50, 'title': 'CFO, Head of Group Exec. Area Fin. & Member of Group Exec. Board', 'yearBorn': 1972, 'exercisedValue': 0, 'unexercisedValue': 0}, {'maxAge': 1, 'name': 'Dr. Martin  Baumuller', 'age': 45, 'title': 'Head of Group Exec. Area Marketing & Brands and Member of the Group Exec. Board', 'yearBorn': 1977, 'exercisedValue': 0, 'unexercisedValue': 0}, {'maxAge': 1, 'name': 'Mr. Andreas  Lange', 'title': 'Head of Quality, Head of the Group Exec. Area Products & Member of the Group Exec. Board', 'exercisedValue': 0, 'unexercisedValue': 0}, {'maxAge': 1, 'name': 'Mr. Ronald  van Triest', 'age': 53, 'title': 'Head of Group Exec. Area Sales International & Member of the Group Exec. Board', 'yearBorn': 1969, 'exercisedValue': 0, 'unexercisedValue': 0}, {'maxAge': 1, 'name': 'Mr. Martin  Ziegler', 'age': 53, 'title': 'Head of Group Exec. Area Products & Operations and Member of Group Exec. Board', 'yearBorn': 1969, 'exercisedValue': 0, 'unexercisedValue': 0}, {'maxAge': 1, 'name': 'Mr. Clemens  Rapp', 'age': 41, 'title': 'Head of Group Exec. Area Sales Europe & Member of the Group Exec. Board', 'yearBorn': 1981, 'exercisedValue': 0, 'unexercisedValue': 0}, {'maxAge': 1, 'name': 'Mr. Thomas  Mattle', 'title': 'Head of Technology & Innovation', 'exercisedValue': 0, 'unexercisedValue': 0}, {'maxAge': 1, 'name': 'Mr. Roman  Sidler', 'title': 'Head of Corp. Communications & Investor Relations', 'exercisedValue': 0, 'unexercisedValue': 0}, {'maxAge': 1, 'name': 'Dr. Albrecht  Riebel', 'age': 58, 'title': 'Head of Legal Services', 'yearBorn': 1964, 'exercisedValue': 0, 'unexercisedValue': 0}]	8.0	3.0	1.0	1.0	2.0	1696118400.0	1672444800.0	86400	2	443.4	439.6	435.2	440.8	443.4	439.6	435.2	440.8	12.6	0.028399998	1682035200.0	0.6367	2.29	0.763941	22.057632	21.631134	10529	10529	85607	83437	83437	436.1	436.3	0.0	0.0	14630840320.0	406.6	542.0	4.689973	454.02	483.8055	12.6	0.02841678	CHF	16152543232.0	0.21564	33121459.0	33533900.0	0.00449	0.40053	33533900.0	36.575	11.928912	1672444800.0	1703980800.0	1688083200.0	-0.157	672700032.0	19.78	20.17	15.17	10:1	1178582400.0	5.178	18.93	0.01627326	0.18349409	12.6	1682035200.0	EBS	EQUITY	GEBN.SW	GEBN.SW	GEBERIT N	Geberit AG	922690800	Europe/Zurich	CEST	9e5e331e-a2f8-33a8-a621-7c7116eb6a8f	finmb_28856	7200000	436.3	630.0	360.0	454.22	452.5	3.3	hold	18.0	137500000.0	4.1	853299968.0	1421100032.0	0.767	1.795	3119600128.0	115.866	91.868	0.12958999	0.49372002	2317400000.0	412712512.0	761400000.0	-0.134	-0.194	0.70509005	0.27353	0.23372	CHF	5.9819	0.01638452202133749	0.2600962237147219	CH0030170408																		
Chemin de la Parfumerie 5	Vernier	1214	Switzerland	41 22 780 91 11		https://www.givaudan.com	Specialty Chemicals	specialty-chemicals	Specialty Chemicals	Basic Materials	basic-materials	Basic Materials	Givaudan SA manufactures, supplies, and sells fragrance, beauty, taste, and wellbeing products to the consumer goods industry. The company operates through divisions, Fragrance & Beauty, and Taste & Wellbeing. The Fragrance & Beauty division offers fine fragrances; consumer products, such as personal, home, fabric, and oral care; fragrance ingredients; and active beauty products. The Taste & Wellbeing division provides beverages, such as fizzy drinks, juices, bottled waters, ready-to-drink products, alcoholic beverages, and others; dairy and cheese products, including dairy drinks, yoghurt, ice cream, chilled desserts, cream cheese, and spreads; snacks comprising rice crackers and cassava chips; savory and nutraceutical products; and biscuits, crackers, and cereals, as well as confectionery products, such as chewing gums, chocolates, and sweets. It operates in Switzerland, Europe, Africa, the Middle East, North America, Latin America, and the Asia Pacific. The company was founded in 1796 and is headquartered in Vernier, Switzerland.	16439.0	"[{'maxAge': 1, 'name': 'Mr. Gilles  Andrier', 'age': 61, 'title': 'Chief Exec. Officer', 'yearBorn': 1961, 'fiscalYear': 2022, 'totalPay': 3510485, 'exercisedValue': 0, 'unexercisedValue': 0}, {'maxAge': 1, 'name': 'Mr. Thomas  Hallam', 'age': 56, 'title': 'Chief Financial Officer', 'yearBorn': 1966, 'exercisedValue': 0, 'unexercisedValue': 0}, {'maxAge': 1, 'name': 'Pierre  Bénaich', 'title': 'Head of Media & Investor Relations', 'exercisedValue': 0, 'unexercisedValue': 0}, {'maxAge': 1, 'name': 'Mr. Simon  Halle-Smith', 'age': 56, 'title': 'Head of Global HR & EHS', 'yearBorn': 1966, 'exercisedValue': 0, 'unexercisedValue': 0}, {'maxAge': 1, 'name': 'Mr. Maurizio  Volpi', 'age': 53, 'title': 'Pres of Fragrance & Beauty', 'yearBorn': 1969, 'exercisedValue': 0, 'unexercisedValue': 0}, {'maxAge': 1, 'name': 'Ms. Anne  Tayac', 'age': 54, 'title': 'Head of Givaudan Bus. Solutions', 'yearBorn': 1968, 'exercisedValue': 0, 'unexercisedValue': 0}, {'maxAge': 1, 'name': ""Mr. Louie  D'Amico"", 'age': 61, 'title': 'Pres of Taste & Wellbeing', 'yearBorn': 1961, 'exercisedValue': 0, 'unexercisedValue': 0}, {'maxAge': 1, 'name': 'Mr. Hallvard  Bremnes', 'title': 'Head of Sustainability', 'exercisedValue': 0, 'unexercisedValue': 0}, {'maxAge': 1, 'name': 'Ms. Sandra  Girgis', 'title': 'Head of Environmental Sustainability', 'exercisedValue': 0, 'unexercisedValue': 0}, {'maxAge': 1, 'name': 'Mr. Willem  Mutsaerts', 'age': 60, 'title': 'Head of Global Procurement & Sustainability', 'yearBorn': 1962, 'exercisedValue': 0, 'unexercisedValue': 0}]"	7.0	2.0	2.0	1.0	1.0	1696118400.0	1672444800.0	86400	2	2890.0	2866.0	2863.0	2904.0	2890.0	2866.0	2863.0	2904.0	67.0	0.0232	1679875200.0	0.71639997	1.96	0.438502	30.958992	26.395338	3132	3132	16193	17561	17561	2898.0	2900.0	0.0	0.0	26749798400.0	2691.0	3343.0	3.8213997	2880.44	2946.345	67.0	0.02318339	CHF	31901749248.0	0.12357	7925838.0	9227250.0	0.1899	0.32031	9227250.0	427.105	6.787558	1672444800.0	1703980800.0	1688083200.0	0.02	865000000.0	93.64	109.83				4.557	24.223	-0.010273993	0.18349409	67.0	1679875200.0	EBS	EQUITY	GIVN.SW	GIVN.SW	GIVAUDAN N	Givaudan SA	946886400	Europe/Zurich	CEST	4b12a3d6-c1ea-3752-9a10-26b48f4749e8	finmb_1511174	7200000	2899.0	4200.0	2400.0	3299.25	3350.0	2.7	hold	20.0	250000000.0	27.094	1316999936.0	5480000000.0	0.732	1.297	7000000000.0	138.875	758.87	0.05627	0.21715	2762000000.0	392750016.0	1156999936.0	0.021	-0.032	0.393	0.18813999	0.15100001	CHF	4.1381	0.014842199137577035	0.23561260696395708	CH0010645932																		
Grafenauweg 10	Zug	6300	Switzerland	41 58 858 58 58		https://www.holcim.com	Building Materials	building-materials	Building Materials	Basic Materials	basic-materials	Basic Materials	Holcim Ltd, together with its subsidiaries, operates as a building materials and solutions company worldwide. It offers cement, clinker, and other cementitious materials; aggregates, such as crushed stone, gravel, and sand; and ready-mix concrete, precast, concrete products, asphalts, mortars, roofing systems, and contracting and services. The company also engages in the retail activities, as well as waste management services. Its products are used in infrastructure projects, such as tunnels, railways and train stations, airports and ports, and bridges; housing projects, including individual and collective housing; commercial projects comprising offices, retails, and public buildings; and industrial projects consisting of renewable energy, oil and gas, and mining. The company was formerly known as LafargeHolcim Ltd and changed its name to Holcim Ltd in May 2021. Holcim Ltd was founded in 1833 and is headquartered in Zug, Switzerland.	60422.0	[{'maxAge': 1, 'name': 'Mr. Jan Philipp Jenisch', 'age': 56, 'title': 'CEO & Chairman', 'yearBorn': 1966, 'fiscalYear': 2022, 'totalPay': 6020459, 'exercisedValue': 0, 'unexercisedValue': 0}, {'maxAge': 1, 'name': 'Mr. Steffen  Kindler', 'age': 51, 'title': 'Chief Financial Officer', 'yearBorn': 1971, 'exercisedValue': 0, 'unexercisedValue': 0}, {'maxAge': 1, 'name': 'Mr. Markus L. Unternahrer', 'title': 'Head of Group Treasury & Head of Investor Relations', 'exercisedValue': 0, 'unexercisedValue': 0}, {'maxAge': 1, 'name': 'Mr. Mathias  Gaertner', 'age': 49, 'title': 'Head of Legal & Compliance', 'yearBorn': 1973, 'exercisedValue': 0, 'unexercisedValue': 0}, {'maxAge': 1, 'name': 'Mr. Feliciano Gonzalez Munoz', 'age': 59, 'title': 'Group Head of HR', 'yearBorn': 1963, 'exercisedValue': 0, 'unexercisedValue': 0}, {'maxAge': 1, 'name': 'Mr. Martin  Kriegner', 'age': 61, 'title': 'Region Head of Asia, Middle East & Africa', 'yearBorn': 1961, 'exercisedValue': 0, 'unexercisedValue': 0}, {'maxAge': 1, 'name': 'Mr. Oliver  Osswald', 'age': 51, 'title': 'Region Head of Latin America', 'yearBorn': 1971, 'exercisedValue': 0, 'unexercisedValue': 0}, {'maxAge': 1, 'name': 'Ms. Jamie M. Gentoso P.E.', 'age': 45, 'title': 'Global Head of Solutions & Products Bus. Unit', 'yearBorn': 1977, 'exercisedValue': 0, 'unexercisedValue': 0}, {'maxAge': 1, 'name': 'Mr. Miljan  Gutovic', 'age': 43, 'title': 'Head of Region Europe', 'yearBorn': 1979, 'exercisedValue': 0, 'unexercisedValue': 0}, {'maxAge': 1, 'name': 'Mr. Keith  Carr', 'age': 56, 'title': 'Exec. Officer', 'yearBorn': 1966, 'exercisedValue': 0, 'unexercisedValue': 0}]	8.0	4.0	1.0	1.0	2.0	1696118400.0	1672444800.0	86400	2	57.88	57.72	57.18	57.82	57.88	57.72	57.18	57.82	2.5	0.0432	1683590400.0	0.4348	4.32	1.088999	10.034782	10.433996	182855	182855	1060914	953170	953170	57.66	57.68			32958586880.0	41.59	62.76	1.1952344	58.238	57.5648	2.5	0.04319281	CHF	45215830016.0	0.123730004	506258461.0	571206016.0	0.11586001	0.35658002	571206016.0	46.164	1.2498916	1672444800.0	1703980800.0	1688083200.0	0.09	3395000064.0	5.75	5.53	0.88	21:20	1441670400.0	1.64	8.932	0.3650943	0.18349409	2.5	1683590400.0	EBS	EQUITY	HOLN.SW	HOLN.SW	HOLCIM N	Holcim Ltd	990601200	Europe/Zurich	CEST	20388ece-d0a6-3085-b190-da420746ccc6	finmb_410180	7200000	57.7	74.5	44.6	64.3	65.0	2.3	buy	22.0	3654000128.0	6.381	5062000128.0	14853000192.0	0.952	1.478	27574999040.0	54.391	47.172	0.03645	0.12369	12194000000.0	2281874944.0	4341000192.0	0.153	-0.11	0.42118	0.18357	0.12323	CHF	1.2514	0.011607528295358036	0.18426379923397715	CH0012214059																		
