De Run 6501	Veldhoven	5504 DR	Netherlands	31 48 0235 0934		https://www.asml.com	Semiconductor Equipment & Materials	semiconductor-equipment-materials	Semiconductor Equipment & Materials	Technology	technology	Technology	ASML Holding N.V. develops, produces, markets, sells, and services advanced semiconductor equipment systems consisting of lithography, metrology, and inspection systems for memory and logic chipmakers. The company provides extreme ultraviolet lithography systems; and deep ultraviolet lithography systems comprising immersion and dry lithography solutions to manufacture various range of semiconductor nodes and technologies. It also offers metrology and inspection systems, including YieldStar optical metrology solutions to assess the quality of patterns on the wafers; and HMI e-beam solutions to locate and analyze individual chip defects. In addition, the company provides computational lithography and lithography process and control software solutions; and refurbishes and upgrades older lithography systems, as well as offers customer support and associated services. It operates in Japan, South Korea, Singapore, Taiwan, China, rest of Asia, the Netherlands, rest of Europe, the Middle East, Africa, and the United States. The company was formerly known as ASM Lithography Holding N.V. and changed its name to ASML Holding N.V. in 2001. ASML Holding N.V. was founded in 1984 and is headquartered in Veldhoven, the Netherlands.	38866.0	[{'maxAge': 1, 'name': 'Mr. Peter T. F. M. Wennink', 'age': 65, 'title': 'Chairman of the Management Board, President & CEO', 'yearBorn': 1957, 'fiscalYear': 2022, 'totalPay': 2245000, 'exercisedValue': 0, 'unexercisedValue': 0}, {'maxAge': 1, 'name': 'Mr. Martin A. van den Brink', 'age': 65, 'title': 'Vice Chairman of the Management Board, President & CTO', 'yearBorn': 1957, 'fiscalYear': 2022, 'totalPay': 2244000, 'exercisedValue': 0, 'unexercisedValue': 0}, {'maxAge': 1, 'name': 'Mr. Roger J. M. Dassen', 'age': 57, 'title': 'Executive VP, CFO & Member of the Management Board', 'yearBorn': 1965, 'fiscalYear': 2022, 'totalPay': 1480000, 'exercisedValue': 0, 'unexercisedValue': 0}, {'maxAge': 1, 'name': 'Mr. Frederic J. M. Schneider-Maunoury', 'age': 61, 'title': 'Executive VP, COO & Member of the Management Board', 'yearBorn': 1961, 'fiscalYear': 2022, 'totalPay': 1490000, 'exercisedValue': 0, 'unexercisedValue': 0}, {'maxAge': 1, 'name': 'Mr. Christophe D. Fouquet', 'age': 49, 'title': 'Executive VP, Chief Business Officer & Member of Management Board', 'yearBorn': 1973, 'fiscalYear': 2022, 'totalPay': 1444000, 'exercisedValue': 0, 'unexercisedValue': 0}, {'maxAge': 1, 'name': 'Mr. Wayne R. Allan', 'age': 54, 'title': 'Executive VP, Chief Strategic Sourcing & Procurement Officer and Member of Management Board', 'yearBorn': 1968, 'fiscalYear': 2022, 'exercisedValue': 0, 'unexercisedValue': 0}, {'maxAge': 1, 'name': 'Mr. Skip  Miller', 'title': 'Vice President of Investor Relations', 'fiscalYear': 2022, 'exercisedValue': 0, 'unexercisedValue': 0}, {'maxAge': 1, 'name': 'Mr. James  Koonmen', 'title': 'Executive VP of Applications Business', 'fiscalYear': 2022, 'exercisedValue': 0, 'unexercisedValue': 0}, {'maxAge': 1, 'name': 'Ron  Kool', 'title': 'Executive Vice President of Business Line DUV', 'fiscalYear': 2022, 'exercisedValue': 0, 'unexercisedValue': 0}, {'maxAge': 1, 'name': 'Rob Van Vliet', 'title': 'Investor Relations Manager', 'fiscalYear': 2022, 'exercisedValue': 0, 'unexercisedValue': 0}]	1.0	1.0	1.0	5.0	1.0	1696118400.0	1672444800.0	86400	2	572.9	545.0	544.3	574.6	572.9	545.0	544.3	574.6	5.88	0.010299999	1690848000.0	0.3095	0.9	1.168	30.421783	26.67603	345023	345023	570914	574323	574323	0.0	0.0	0.0	0.0	224159318016.0	419.65	698.1	8.669193	582.818	609.9405	4.51	0.007872229	EUR	224618561536.0	0.27402002	393230838.0	393400000.0	8.0000005e-05	0.52964	393400000.0	33.191	17.167303	1672444800.0	1703980800.0	1688256000.0	0.117	7085300224.0	18.73	21.36	1.29	77:100	1353888000.0	8.687	25.283	0.3124857	0.18349409	1.45	1690848000.0	AMS	EQUITY	ASML.AS	ASML.AS	ASML HOLDING	ASML Holding N.V.	946627200	Europe/Amsterdam	CEST	e8240287-e648-32e3-a138-7e0a889a39ef	finmb_388904	7200000	569.8	950.0	440.0	716.6	730.0	2.2	buy	33.0	6346399744.0	16.132	8884299776.0	5586100224.0	0.761	1.316	25856999424.0	42.781	65.395	0.14466	0.68437	10700100000.0	5139137536.0	7710199808.0	0.126	0.271	0.5083	0.34359002	0.33709	EUR	1.2912	0.021071752417695627	0.33450369951328	NL0010273215																		
25, avenue Matignon	Paris	75008	France	33 1 40 75 57 00		https://www.axa.com	Insurance - Diversified	insurance-diversified	Insurance - Diversified	Financial Services	financial-services	Financial Services	AXA SA, through its subsidiaries, provides insurance, asset management, and banking services worldwide. The company operates through six segments: France, Europe, Asia, AXA XL, International, and Transversal & Central Holdings. It offers life and savings insurance products, such as savings and retirement, other health, and personal protection products. The company also provides property and casualty insurance products, including car, home, and personal or professional liability to individual and business clients; international insurance for large corporate clients in Europe; and marine and aviation insurance services, as well as property and casualty reinsurance products. In addition, it offers asset management services in the areas of various asset classes, including equities, bonds, hedge funds, private equity, and real estate for the group's insurance companies and their clients, and retail and institutional clients. Further, the company provides health, term life, whole life, universal life, endowment, and other investment-based products for personal/individual and commercial/ group customers. AXA SA was founded in 1852 and is headquartered in Paris, France.	92695.0	"[{'maxAge': 1, 'name': 'Dr. Thomas  Buberl', 'age': 49, 'title': 'CEO & Director', 'yearBorn': 1973, 'fiscalYear': 2022, 'totalPay': 2871631, 'exercisedValue': 0, 'unexercisedValue': 0}, {'maxAge': 1, 'name': 'Ms. Helen  Browne', 'age': 60, 'title': 'Group General Counsel & Employee Representative Director', 'yearBorn': 1962, 'fiscalYear': 2022, 'totalPay': 93794, 'exercisedValue': 0, 'unexercisedValue': 0}, {'maxAge': 1, 'name': 'Mr. Alban  de Mailly Nesle', 'age': 52, 'title': 'Group Chief Financial Officer', 'yearBorn': 1970, 'fiscalYear': 2022, 'exercisedValue': 0, 'unexercisedValue': 0}, {'maxAge': 1, 'name': 'Dr. Alexander  Vollert', 'age': 53, 'title': 'Group Chief Operating Officer', 'yearBorn': 1969, 'fiscalYear': 2022, 'exercisedValue': 0, 'unexercisedValue': 0}, {'maxAge': 1, 'name': 'Gregoire de Montchalin', 'title': 'Chief Accounting & Reporting Officer', 'fiscalYear': 2022, 'exercisedValue': 0, 'unexercisedValue': 0}, {'maxAge': 1, 'name': 'Ms. Anu  Venkataraman', 'title': 'Group Chief Strategy Officer & Head of Investor Relations', 'fiscalYear': 2022, 'exercisedValue': 0, 'unexercisedValue': 0}, {'maxAge': 1, 'name': 'Mr. Andrew  Wallace-Barnett', 'title': 'Group Chief Compliance Officer', 'fiscalYear': 2022, 'exercisedValue': 0, 'unexercisedValue': 0}, {'maxAge': 1, 'name': 'Ms. Ulrike  Decoene', 'title': 'Group Chief Communication, Brand & Sustainability Officer', 'fiscalYear': 2022, 'exercisedValue': 0, 'unexercisedValue': 0}, {'maxAge': 1, 'name': 'Ms. Karima  Silvent', 'age': 48, 'title': 'Group Chief Human Resources Officer', 'yearBorn': 1974, 'fiscalYear': 2022, 'exercisedValue': 0, 'unexercisedValue': 0}, {'maxAge': 1, 'name': ""Mr. Frederic Marie de Courtois D'Arcollières"", 'age': 55, 'title': 'Group Deputy Chief Executive Officer', 'yearBorn': 1967, 'fiscalYear': 2022, 'exercisedValue': 0, 'unexercisedValue': 0}]"	4.0	5.0	4.0	1.0	2.0	1696118400.0	1672444800.0	86400	2	28.275	28.405	28.21	28.455	28.275	28.405	28.21	28.455	1.7	0.060100004	1683504000.0	0.59029996	5.3	1.338	9.845486	7.789835	173372	173372	2988669	2977614	2977614	0.0	0.0	0.0	0.0	63941091328.0	23.895	30.34	0.62679356	28.0079	27.82855	1.7	0.060123786	EUR	59535876096.0	0.06525	1855365590.0	2255020032.0	0.20166	0.42319	2255020032.0	20.644	1.3735226	1672444800.0	1703980800.0	1688083200.0	-0.005	6472999936.0	2.88	3.64	1.46	4:1	989971200.0	0.584		0.14390695	0.18349409	1.7	1683504000.0	PAR	EQUITY	CS.PA	CS.PA	AXA	AXA SA	651481200	Europe/Paris	CEST	8d6b474a-15eb-38c4-9e9e-2bff261dcf4c	finmb_121238	7200000	28.355	37.0	29.5	33.5	33.8	1.8	buy	18.0	71646003200.0	32.216		58503000064.0	2.686	4.326	102013001728.0	105.015	45.239	0.00838	0.11658	19490000000.0	-875374976.0	9427999744.0	0.03	-0.039	0.1887	0.0	0.11915	EUR		0.012772101054268917	0.20275081865628858	FR0000120628																		
Santander Group City	Madrid	28660	Spain	34 91 259 65 20		https://www.santander.com	Banks - Diversified	banks-diversified	Banks - Diversified	Financial Services	financial-services	Financial Services	Banco Santander, S.A. provides various retail and commercial banking products and services to individuals, small and medium-sized enterprises, and large companies worldwide. The company operates through Retail Banking, Santander Corporate & Investment Banking, Wealth Management & Insurance, and PagoNxt segments. It offers demand and time deposits, and current and savings accounts; mortgages, consumer finance, syndicated corporate loans, cash management, export and agency finance, trade and working capital solutions, and corporate finance; and insurance products. The company also provides cash, asset, and wealth management; and private banking services. In addition, it is involved in the corporate banking, treasury, risk hedging, foreign trade, and investment banking activities, as well as provides digital payment solutions. The company was formerly known as Banco Santander Central Hispano S.A. and changed its name to Banco Santander, S.A. in June 2007. Banco Santander, S.A. was founded in 1856 and is headquartered in Madrid, Spain.	212409.0	"[{'maxAge': 1, 'name': ""Ms. Ana Botin-Sanz de Sautuola y O'Shea"", 'age': 62, 'title': 'Group Executive Chairwoman', 'yearBorn': 1960, 'fiscalYear': 2022, 'totalPay': 11001000, 'exercisedValue': 0, 'unexercisedValue': 0}, {'maxAge': 1, 'name': 'Mr. Hector Blas Grisi Checa', 'age': 56, 'title': 'Group CEO & Group Director', 'yearBorn': 1966, 'fiscalYear': 2022, 'exercisedValue': 0, 'unexercisedValue': 0}, {'maxAge': 1, 'name': 'Mr. Jose Antonio Garcia-Cantera', 'age': 56, 'title': 'Senior EVP & Group Chief Financial Officer', 'yearBorn': 1966, 'fiscalYear': 2022, 'exercisedValue': 0, 'unexercisedValue': 0}, {'maxAge': 1, 'name': 'Mr. Dirk  Ludwig Marzluf', 'age': 52, 'title': 'Senior EVP and Group Head of Technology & Operations', 'yearBorn': 1970, 'fiscalYear': 2022, 'exercisedValue': 0, 'unexercisedValue': 0}, {'maxAge': 1, 'name': 'Mr. Jose Francisco Doncel Razola', 'age': 61, 'title': 'Senior EVP, Group Head of Accounting & Financial Control and Group Chief Accounting Officer', 'yearBorn': 1961, 'fiscalYear': 2022, 'exercisedValue': 0, 'unexercisedValue': 0}, {'maxAge': 1, 'name': 'Mr. Jose Maria Linares Perou', 'age': 51, 'title': 'Senior EVP and Global Head of Corporate & Investment Banking', 'yearBorn': 1971, 'fiscalYear': 2022, 'exercisedValue': 0, 'unexercisedValue': 0}, {'maxAge': 1, 'name': 'Ms. Begona  Morenes', 'title': 'Global Head of Investor Relations', 'fiscalYear': 2022, 'exercisedValue': 0, 'unexercisedValue': 0}, {'maxAge': 1, 'name': 'Ms. Marjolein  van Hellemondt-Gerdingh', 'age': 58, 'title': 'Group Chief Compliance Officer & Senior EVP', 'yearBorn': 1964, 'fiscalYear': 2022, 'exercisedValue': 0, 'unexercisedValue': 0}, {'maxAge': 1, 'name': 'Mr. Juan Manuel Cendoya Mendez de Vigo', 'age': 55, 'title': 'Senior EVP and Group Head of Communications, Corporate Marketing & Research', 'yearBorn': 1967, 'fiscalYear': 2022, 'exercisedValue': 0, 'unexercisedValue': 0}, {'maxAge': 1, 'name': 'Mr. Jose Luis De Mora Gil-Gallardo', 'age': 56, 'title': 'Group Head of Strategy & Corp. Dev., Fin. Planning & Santander Consumer Finance and Senior EVP', 'yearBorn': 1966, 'fiscalYear': 2022, 'exercisedValue': 0, 'unexercisedValue': 0}]"	2.0	2.0	2.0	1.0	1.0	1696118400.0	1672444800.0	86400	4	3.572	3.557	3.532	3.572	3.572	3.557	3.532	3.572	0.16	0.0454	1698710400.0	0.2042	5.11	1.361	6.131035	6.838462	3678802	3678802	27829755	28321857	28321857	3.556	3.5575	0.0	0.0	57242710016.0	2.5015	3.8725	1.3337693	3.53472	3.400795	0.141	0.039473686	EUR	29368317952.0	0.23188	15983419985.0	16097500160.0	0.00556	0.32342	16115500032.0	5.78	0.6152249	1672444800.0	1703980800.0	1688083200.0	0.136	9486000128.0	0.58	0.52	0.46	24:23	1605484800.0	0.684		0.355855	0.18349409	0.081	1698710400.0	MCE	EQUITY	SAN.MC	SAN.MC	BANCO SANTANDER S.A.	Banco Santander, S.A.	946886400	Europe/Madrid	CEST	ab3fe52e-812b-388c-b2e7-4a813a13513c	finmb_323930	7200000	3.556	5.1	2.7	3.97	4.0	2.1	buy	22.0	400756998144.0	24.784		363790991360.0			42917998592.0		2.599	0.0063	0.11059	41273000000.0		8424999936.0	0.293	0.118	0.0	0.0	0.38097	EUR	0.6554	0.018377203912270254	0.2917290680675421	ES0113900J37	Av. de Cantabria s/n Boadilla del Monte																	
Kaiser-Wilhelm-Allee 1	Leverkusen	51368	Germany	49 214 30 1		https://www.bayer.com	Drug Manufacturers - General	drug-manufacturers-general	Drug Manufacturers - General	Healthcare	healthcare	Healthcare	Bayer Aktiengesellschaft, together its subsidiaries, operates as a life science company worldwide. It operates through Pharmaceuticals, Consumer Health, and Crop Science segments. The Pharmaceuticals segment offers prescription products primarily for cardiology and women's health care; specialty therapeutics in the areas of oncology, hematology, and ophthalmology; and diagnostic imaging equipment and contrast agents, as well as cell and gene therapy. The Consumer Health segment markets nonprescription over-the-counter medicines, medical products, medicated skincare products, nutritional supplements, and self-care solutions in dermatology, nutritional supplements, pain and cardiovascular risk prevention, digestive health, allergy, and cold and cough. The Crop Science segment offers chemical and biological crop protection products, improved plant traits, seeds, digital solution, and pest and weed control products, as well as customer service for agriculture. This segment also provides breeding, propagation, and production/processing of seeds, including seed dressing. The company has a collaboration agreement with MD Anderson Cancer Center to develop oncology drugs; research and license agreement with Dewpoint Therapeutics, Inc. for the development of new treatments for cardiovascular and gynecological diseases; collaboration agreement with Exscientia Ltd, Foundation Medicine Inc., and Evotec AG; research collaboration with Arvinas Inc.; strategic research partnership with University of Oxford to develop novel gynecological therapies; and Kyoto University to identify new drugs candidates for the treatment of pulmonary diseases, as well as collaboration with Bicycle Therapeutics to develop bicyclic peptides. It distributes its products through wholesalers, pharmacies and pharmacy chains, supermarkets, online and other retailers, and hospitals, as well as directly to farmers. Bayer Aktiengesellschaft was founded in 1863 and is headquartered in Leverkusen, Germany.	102048.0	[{'maxAge': 1, 'name': 'Mr. Wolfgang U. Nickl', 'age': 53, 'title': 'CFO & Member of Management Board', 'yearBorn': 1969, 'fiscalYear': 2022, 'totalPay': 2123000, 'exercisedValue': 0, 'unexercisedValue': 0}, {'maxAge': 1, 'name': 'Mr. Heiko W. J. Schipper', 'age': 53, 'title': 'Member of Management Board & President of the Consumer Health Division', 'yearBorn': 1969, 'fiscalYear': 2022, 'totalPay': 1917000, 'exercisedValue': 0, 'unexercisedValue': 0}, {'maxAge': 1, 'name': 'Mr. Stefan  Oelrich', 'age': 54, 'title': 'Head of the Pharmaceuticals Division & Member of the Board of Management', 'yearBorn': 1968, 'fiscalYear': 2022, 'totalPay': 2083000, 'exercisedValue': 0, 'unexercisedValue': 0}, {'maxAge': 1, 'name': 'Mr. Rodrigo  Santos', 'age': 49, 'title': 'Member of Management Board & President of the Crop Science Division', 'yearBorn': 1973, 'fiscalYear': 2022, 'totalPay': 2165000, 'exercisedValue': 0, 'unexercisedValue': 0}, {'maxAge': 1, 'name': 'Mr. William N. Anderson', 'age': 56, 'title': 'Chairman of the Management Board & CEO', 'yearBorn': 1966, 'fiscalYear': 2022, 'exercisedValue': 0, 'unexercisedValue': 0}, {'maxAge': 1, 'name': 'Ms. Heike  Prinz', 'age': 57, 'title': 'Chief Talent Officer, Labor Director & Member of Management Board', 'yearBorn': 1965, 'fiscalYear': 2022, 'exercisedValue': 0, 'unexercisedValue': 0}, {'maxAge': 1, 'name': 'Mr. Bernd-Peter  Bier', 'age': 55, 'title': 'Head of Accounting and Head of Taxes', 'yearBorn': 1967, 'fiscalYear': 2022, 'exercisedValue': 0, 'unexercisedValue': 0}, {'maxAge': 1, 'name': 'Mr. Oliver  Maier', 'title': 'Head of Investor Relations', 'fiscalYear': 2022, 'exercisedValue': 0, 'unexercisedValue': 0}, {'maxAge': 1, 'name': 'Dr. Gabriel  Harnier', 'age': 51, 'title': 'Head of Law, Patents & Compliance', 'yearBorn': 1971, 'fiscalYear': 2022, 'exercisedValue': 0, 'unexercisedValue': 0}, {'maxAge': 1, 'name': 'Mr. Michael  Preuss', 'title': 'Head of Communications, Government Relations and Corporate Brand', 'fiscalYear': 2022, 'exercisedValue': 0, 'unexercisedValue': 0}]	10.0	2.0	7.0	1.0	6.0	1696118400.0	1672444800.0	86400	2	43.2	43.1	42.86	43.29	43.2	43.1	42.86	43.29	2.4	0.0556	1682985600.0	1.6327001	4.35	1.15	29.306124	6.261628	403386	403386	1971430	2114388	2114388	43.07	43.095	28400.0	2100.0	42322829312.0	42.86	65.66	0.8688022	48.5331	53.494976	2.4	0.055555556	EUR	81503543296.0	0.029719999	982331582.0	982424000.0	0.0	0.50208	982424000.0	37.609	1.1454705	1672444800.0	1703980800.0	1688083200.0		1448000000.0	1.47	6.88	-5.73			1.673	7.32	-0.12371862	0.18349409	2.4	1682985600.0	GER	EQUITY	BAYN.DE	BAYN.DE	BAYER AG NA O.N.	Bayer Aktiengesellschaft	850723200	Europe/Berlin	CEST	9932cc3b-14ad-302f-8869-bd133abe65ab	finmb_103375	7200000	43.08	90.0	43.0	65.9	65.0	2.2	buy	21.0	7630000128.0	7.767	11134999552.0	46516998144.0	0.777	1.205	48713998336.0	125.302	49.586	0.03794	0.038599998	31853000000.0	624249984.0	2648999936.0		-0.138	0.61011004	0.22858	0.12966	EUR	1.4907	0.014872438381322076	0.23609264007666134	DE000BAY0017																		
16 boulevard des Italiens	Paris	75009	France	33 1 40 14 45 46	33 1 42 98 21 22	https://group.bnpparibas	Banks - Regional	banks-regional	Banks - Regional	Financial Services	financial-services	Financial Services	BNP Paribas SA provides various banking and financial products and services in Europe, the Middle East, Africa, the Americas, and the Asia Pacific. It operates through three divisions: Corporate & Institutional Banking; Commercial, Personal Banking & Services; and Investment & Protection Services. The Corporate & Institutional Banking division offers capital market, securities, investment banking, financing, risk management, cash management, and financial advisory services for corporate clients and institutional investors. The Commercial, Personal Banking & Services division provides financing and equipment leasing services, mobility, and digital banking services, as well as current accounts, savings products, bancassurance, insurance products and services, and consumer loans. The Investment & Protection Services division provides protection, savings, investment, and real estate services to support individuals, professionals, corporate clients, and institutions. The company was formerly known as Banque Nationale de Paris and changed its name to BNP Paribas SA in May 2000. BNP Paribas SA was founded in 1822 and is headquartered in Paris, France.	190000.0	[{'maxAge': 1, 'name': 'Mr. Jean-Laurent  Bonnafe', 'age': 61, 'title': 'CEO & Director', 'yearBorn': 1961, 'fiscalYear': 2022, 'totalPay': 3780910, 'exercisedValue': 0, 'unexercisedValue': 0}, {'maxAge': 1, 'name': 'Mr. Yann  Gerardin', 'age': 61, 'title': 'COO and Head of Corporate & Institutional Banking', 'yearBorn': 1961, 'fiscalYear': 2022, 'totalPay': 3103433, 'exercisedValue': 0, 'unexercisedValue': 0}, {'maxAge': 1, 'name': 'Mr. Thierry  Laborde', 'age': 62, 'title': 'COO and Head of Commercial, Personal Banking & Services', 'yearBorn': 1960, 'fiscalYear': 2022, 'totalPay': 1879861, 'exercisedValue': 0, 'unexercisedValue': 0}, {'maxAge': 1, 'name': 'Mr. Hugues  Epaillard', 'age': 56, 'title': 'Business Manager of Real Estate & Employee Representative Director', 'yearBorn': 1966, 'fiscalYear': 2022, 'exercisedValue': 0, 'unexercisedValue': 0}, {'maxAge': 1, 'name': 'Ms. Juliette  Brisac', 'age': 58, 'title': 'Director & COO of Corporate Engagement Department', 'yearBorn': 1964, 'fiscalYear': 2022, 'exercisedValue': 0, 'unexercisedValue': 0}, {'maxAge': 1, 'name': 'Mr. Lars  Machenil', 'age': 53, 'title': 'Group Chief Financial Officer', 'yearBorn': 1969, 'fiscalYear': 2022, 'exercisedValue': 0, 'unexercisedValue': 0}, {'maxAge': 1, 'name': 'Mr. Renaud Fabrice Dumora', 'age': 56, 'title': 'Deputy COO and Head of Investment & Protection Services', 'yearBorn': 1966, 'fiscalYear': 2022, 'exercisedValue': 0, 'unexercisedValue': 0}, {'maxAge': 1, 'name': 'Mr. Bernard  Gavgani', 'title': 'Group Chief Information Officer', 'fiscalYear': 2022, 'exercisedValue': 0, 'unexercisedValue': 0}, {'maxAge': 1, 'name': 'Ms. Stephanie  Maarek', 'title': 'Head of Compliance', 'fiscalYear': 2022, 'exercisedValue': 0, 'unexercisedValue': 0}, {'maxAge': 1, 'name': 'Ms. Elise  Hermant', 'age': 40, 'title': 'Head of Group Communications', 'yearBorn': 1982, 'fiscalYear': 2022, 'exercisedValue': 0, 'unexercisedValue': 0}]	3.0	4.0	1.0	1.0	2.0	1696118400.0	1672444800.0	86400	2	57.68	57.68	57.35	57.98	57.68	57.68	57.35	57.98	3.9	0.067600004	1684713600.0	0.5556	5.26	1.652	8.247864	6.133475	569871	569871	2755890	2711766	2711766	0.0	0.0	0.0	0.0	69108285440.0	45.48	67.02	1.5340012	59.4958	58.75465	3.9	0.06761443	EUR	-507910651904.0	0.27763999	1030377855.0	1166290048.0	0.13122	0.47801998	1193580032.0	91.788	0.63080144	1672444800.0	1703980800.0	1688083200.0	-0.092	8656000000.0	7.02	9.44	0.77	2:1	1014163200.0	-11.274		0.25950122	0.18349409	3.9	1684713600.0	PAR	EQUITY	BNP.PA	BNP.PA	BNP PARIBAS ACT.A	BNP Paribas SA	750931200	Europe/Paris	CEST	ed18c5a1-03a1-3d08-aabb-6db2923685ea	finmb_873976	7200000	57.9	93.0	64.0	77.4	77.0	2.0	buy	22.0	1309622009856.0	1094.303		727678976000.0			45050998784.0		36.617	0.00349	0.07798			-63091998720.0	-0.101	0.029	0.0	0.0	0.32858002	EUR	1.0553	0.01664798706844143	0.26427860167749156	FR0000131104																		
