1 Francis Crick Avenue	Cambridge	CB2 0AA	United Kingdom	44 20 3749 5000		https://www.astrazeneca.com	Drug Manufacturers - General	drug-manufacturers-general	Drug Manufacturers - General	Healthcare	healthcare	Healthcare	AstraZeneca PLC, a biopharmaceutical company, focuses on the discovery, development, manufacture, andcommercialization of prescription medicines. The company's marketed products include Calquence, Enhertu, Faslodex, Imfinzi, Iressa, Koselugo, Lumoxiti, Lynparza, Orpathys, Tagrisso, and Zoladex for oncology; Andexxa/Ondexxya, Atacand, Atacand HCT, Atacand Plus, Brilinta/Brilique, Bydureon/Byetta, BCise, Byetta, Crestor, Evrenzo, Farxiga/Forxiga, Komboglyze/Kombiglyze XR, Lokelma, Onglyza, Qtern, Xigduo/Xigduo, and Zestril XR for cardiovascular, renal, and metabolism diseases; Accolate, Accoleit, Vanticon, Bevespi Aerosphere, Breztri Aerosphere, Bricanyl Respules and Turbuhaler, Daliresp/Daxas, Duaklir Genuair, Fasenra, Pulmicort, Rhinocort, Saphnelo, Symbicort, and Tezspire for respiratory and immunology; and Kanuma, Soliris, Strensiq, and Ultomiris for rare diseases. Its marketed products also comprise Synagis for respiratory syncytial virus; Fluenz Tetra/FluMist Quadrivalent for Influenza; and Vaxzevria and Evusheld for covid-19. The company serves primary care and specialty care physicians through distributors and local representative offices in the United Kingdom, rest of Europe, the Americas, Asia, Africa, and Australasia. It has a collaboration agreement with Neurimmune AG to develop and commercialize NI006; and Personalis, Inc, as well as research collaboration with Sernova Corp. to evaluate novel potential therapeutic cell applications; and collaboration with Cholesgen (Shanghai) Co.Ltd. to advance research and development in hypercholesterolemia and related metabolic diseases, as well as a collaboration with BioCity Biopharma to evaluate a monoclonal antibody for the treatment of advanced hepatocellular carcinoma. The company was formerly known as Zeneca Group PLC and changed its name to AstraZeneca PLC in April 1999. AstraZeneca PLC was incorporated in 1992 and is headquartered in Cambridge, the United Kingdom.	83500.0	[{'maxAge': 1, 'name': 'Mr. Pascal  Soriot D.V.M., M.B.A.', 'age': 63, 'title': 'CEO & Executive Director', 'yearBorn': 1959, 'fiscalYear': 2022, 'totalPay': 4780000, 'exercisedValue': 0, 'unexercisedValue': 0}, {'maxAge': 1, 'name': 'Dr. Aradhana  Sarin M.D.', 'age': 47, 'title': 'Executive Director', 'yearBorn': 1975, 'fiscalYear': 2022, 'totalPay': 2735000, 'exercisedValue': 0, 'unexercisedValue': 0}, {'maxAge': 1, 'name': 'Ms. Pam P. Cheng', 'age': 51, 'title': 'EVP of Global opt. & IT, Chief Sust. Officer and Member of External Sust.Adv. Board', 'yearBorn': 1971, 'fiscalYear': 2022, 'exercisedValue': 0, 'unexercisedValue': 0}, {'maxAge': 1, 'name': 'Mr. Andrew P. Barnett', 'title': 'Head of Investor Relations', 'fiscalYear': 2022, 'exercisedValue': 0, 'unexercisedValue': 0}, {'maxAge': 1, 'name': 'Mr. Jeffrey  Pott', 'title': 'CHRO, Chief Compliance Officer, General Counsel & Member of External Sustainability Advisory Board', 'fiscalYear': 2022, 'exercisedValue': 0, 'unexercisedValue': 0}, {'maxAge': 1, 'name': 'Gonzalo  Vina', 'title': 'Head of Global Media Relations', 'fiscalYear': 2022, 'exercisedValue': 0, 'unexercisedValue': 0}, {'maxAge': 1, 'name': 'Dr. Menelas  Pangalos Ph.D.', 'age': 55, 'title': 'EVP of BioPharmaceuticals R&D and Member of External Sustainability Advisory Board', 'yearBorn': 1967, 'fiscalYear': 2022, 'exercisedValue': 0, 'unexercisedValue': 0}, {'maxAge': 1, 'name': 'Dr. Ruud  Dobber Ph.D.', 'title': 'Executive Vice-President of BioPharmaceuticals Business Unit', 'fiscalYear': 2022, 'exercisedValue': 0, 'unexercisedValue': 0}, {'maxAge': 1, 'name': 'Dr. Susan Mary Galbraith M.D., Ph.D.', 'age': 56, 'title': 'Executive Vice President of Oncology Research & Development', 'yearBorn': 1966, 'fiscalYear': 2022, 'exercisedValue': 0, 'unexercisedValue': 0}, {'maxAge': 1, 'name': 'Mr. Leon  Wang', 'title': 'Executive VP of International & China President', 'fiscalYear': 2022, 'exercisedValue': 0, 'unexercisedValue': 0}]	6.0	2.0	3.0	1.0	2.0	1696118400.0	1672444800.0	86400	2	11270.0	11176.0	11092.0	11244.0	11270.0	11176.0	11092.0	11244.0	2.35	0.0208	1691625600.0	0.7225	2.62	0.162	34.427242	1593.1232	204662	204662	2023329	1679399	1679399	11118.0	11122.0	0.0	0.0	172349997056.0	9499.214	12828.452	3.8743396	10866.12	11175.78	2.9	0.00025732032	GBp	199690993664.0	0.13854	1545257000.0	1549910016.0	0.0023	0.52002996	1568259968.0	24.124	460.95175	1672444800.0	1703980800.0	1688083200.0	4.05	6162999808.0	3.23	6.98	2.23			4.489	11.34	0.118564606	0.18349409	71.8	1691625600.0	LSE	EQUITY	AZN.L	AZN.L	ASTRAZENECA PLC ORD SHS $0.25	AstraZeneca PLC	737967600	Europe/London	BST	27544b2d-307c-3184-8717-9e464471fcc0	finmb_336774	3600000	11120.0	173.21	62.53	131.38	134.21	1.9	buy	27.0	5811999744.0	3.75	17610000384.0	30794000384.0	0.673	0.866	44485001216.0	82.302	28.728	0.08324	0.16816999	35732000000.0	10935874560.0	10179000320.0	4.087	0.06	0.86961997	0.39586	0.22793	USD	0.5181	0.01345668545965584	0.21361825918480953	GB0009895292	Cambridge Biomedical Campus																	
1 Churchill Place	London	E14 5HP	United Kingdom	44 20 7116 1000		https://home.barclays	Banks - Diversified	banks-diversified	Banks - Diversified	Financial Services	financial-services	Financial Services	Barclays PLC provides various financial services in the United Kingdom, Europe, the Americas, Africa, the Middle East, and Asia. The company operates through two segments, Barclays UK and Barclays International divisions. It offers financial services, such as retail banking, credit cards, wholesale banking, investment banking, wealth management, and investment management services. The company also engages in securities dealing activities. The company was formerly known as Barclays Bank Limited and changed its name to Barclays PLC in January 1985. Barclays PLC was founded in 1690 and is headquartered in London, the United Kingdom.	87400.0	[{'maxAge': 1, 'name': 'Mr. Coimbatore Sundararajan Venkatakrishnan', 'age': 56, 'title': 'Group CEO & Executive Director', 'yearBorn': 1966, 'fiscalYear': 2022, 'totalPay': 5197000, 'exercisedValue': 0, 'unexercisedValue': 0}, {'maxAge': 1, 'name': 'Ms. Angela Anna Cross', 'age': 52, 'title': 'Group Finance Director & Executive Director', 'yearBorn': 1970, 'fiscalYear': 2022, 'totalPay': 2592620, 'exercisedValue': 0, 'unexercisedValue': 0}, {'maxAge': 1, 'name': 'Mr. Alistair  Currie', 'title': 'Group COO & Chief Executive of Barclays Execution Services (BX)', 'fiscalYear': 2022, 'exercisedValue': 0, 'unexercisedValue': 0}, {'maxAge': 1, 'name': 'Ms. Susannah Hall Parden', 'title': 'Group Chief Accounting Officer', 'fiscalYear': 2022, 'exercisedValue': 0, 'unexercisedValue': 0}, {'maxAge': 1, 'name': 'Mr. Reid  Marsh', 'title': 'Global Chairman of Investment Banking & Acting Head of European Banking', 'fiscalYear': 2022, 'exercisedValue': 0, 'unexercisedValue': 0}, {'maxAge': 1, 'name': 'Marco  Valla', 'title': 'Global Head of Technology, Media & Telecoms and Consumer & Retail Investment Banking', 'fiscalYear': 2022, 'exercisedValue': 0, 'unexercisedValue': 0}, {'maxAge': 1, 'name': 'Dr. Adam  Kelleher', 'title': 'Chief Data Scientist for Research', 'fiscalYear': 2022, 'exercisedValue': 0, 'unexercisedValue': 0}, {'maxAge': 1, 'name': 'Mr. Craig  Bright', 'age': 56, 'title': 'Chief Information Officer', 'yearBorn': 1966, 'fiscalYear': 2022, 'exercisedValue': 0, 'unexercisedValue': 0}, {'maxAge': 1, 'name': 'Mr. Stephen Victor Shapiro', 'title': 'Group General Counsel', 'fiscalYear': 2022, 'exercisedValue': 0, 'unexercisedValue': 0}, {'maxAge': 1, 'name': 'Ms. Kirsty  Everett', 'age': 45, 'title': 'Group Chief Compliance Officer', 'yearBorn': 1977, 'fiscalYear': 2022, 'exercisedValue': 0, 'unexercisedValue': 0}]	10.0	1.0	5.0	1.0	4.0	1696118400.0	1672444800.0	86400	2	154.8	153.92	153.0	155.92	154.8	153.92	153.0	155.92	0.08	0.0497	1691625600.0	0.20950001	2.92	1.353	4.4026856	4.5482287	5288501	5288501	45894597	48052465	48052465	154.1	154.12	0.0	0.0	23321354240.0	128.12	198.862	0.9924403	151.5012	158.2327	0.077	0.000497416	GBp	64077959168.0	0.28329	13501468800.0	15134499840.0	0.00385	0.56027	15153999872.0	3.474	44.35636	1672444800.0	1703980800.0	1688083200.0	0.251	5658999808.0	0.35	33.88	-1.84	4:1	1020038400.0	2.727		0.0620929	0.18349409	2.7	1691625600.0	LSE	EQUITY	BARC.L	BARC.L	BARCLAYS PLC ORD 25P	Barclays PLC	583743600	Europe/London	BST	8cde842e-616e-3437-9dd2-41970a5bd6d9	finmb_323899	3600000	154.094	344.39	170.0	238.17	230.0	2.2	buy	14.0	687575990272.0	44.303		726753017856.0			23498999808.0		1.486	0.00428	0.09646	23736000000.0		5856999936.0	0.313	-0.091	0.0	0.0	0.35176998	GBP		0.018293910703050777	0.29040682936257084	GB0031348658																		
1 St James's Square	London	SW1Y 4PD	United Kingdom	44 20 7496 4000	44 20 7496 4630	https://www.bp.com	Oil & Gas Integrated	oil-gas-integrated	Oil & Gas Integrated	Energy	energy	Energy	BP p.l.c. provides carbon products and services. The company operates through Gas & Low Carbon Energy, Oil Production & Operations, and Customers & Products segments. It engages in the production of natural gas, and integrated gas and power; trading of gas; operation of onshore and offshore wind power, as well as hydrogen and carbon capture and storage facilities; trading and marketing of renewable and non-renewable power; and production of crude oil. In addition, the company involved in convenience and retail fuel, EV charging, Castrol lubricant, aviation, B2B, and midstream businesses; refining and oil trading; and bioenergy business. Further, it engages in power and storage, digital transformation, carbon management, and bio and low carbon related products, as well as energy and environmental commodities and mobility businesses. The company was founded in 1908 and is headquartered in London, the United Kingdom.	67600.0	[{'maxAge': 1, 'name': 'Mr. Murray  Auchincloss', 'age': 52, 'title': 'Interim CEO & Director', 'yearBorn': 1970, 'fiscalYear': 2022, 'totalPay': 2391000, 'exercisedValue': 0, 'unexercisedValue': 0}, {'maxAge': 1, 'name': 'Ms. Katherine Anne Thomson', 'age': 54, 'title': 'Senior VP of Finance for Production & Operations and Interim CFO', 'yearBorn': 1968, 'fiscalYear': 2022, 'exercisedValue': 0, 'unexercisedValue': 0}, {'maxAge': 1, 'name': 'Mr. Gordon  Birrell', 'age': 59, 'title': 'Executive Vice President of Production & Operations', 'yearBorn': 1963, 'fiscalYear': 2022, 'exercisedValue': 0, 'unexercisedValue': 0}, {'maxAge': 1, 'name': 'Mr. Craig  Marshall', 'title': 'Group Head of Investor Relations', 'fiscalYear': 2022, 'exercisedValue': 0, 'unexercisedValue': 0}, {'maxAge': 1, 'name': 'Mr. Eric  Nitcher', 'age': 59, 'title': 'Executive Vice President of Legal', 'yearBorn': 1963, 'fiscalYear': 2022, 'exercisedValue': 0, 'unexercisedValue': 0}, {'maxAge': 1, 'name': 'Mr. Rahul  Saxena', 'title': 'Group Ethics & Compliance Officer', 'fiscalYear': 2022, 'exercisedValue': 0, 'unexercisedValue': 0}, {'maxAge': 1, 'name': 'Mr. Marco  Ryan', 'title': 'Senior Vice President of Digital Customers & Markets', 'fiscalYear': 2022, 'exercisedValue': 0, 'unexercisedValue': 0}, {'maxAge': 1, 'name': 'Ms. Kerry  Dryburgh', 'title': 'Executive Vice President of People & Culture', 'fiscalYear': 2022, 'exercisedValue': 0, 'unexercisedValue': 0}, {'maxAge': 1, 'name': 'Mr. Richard M. Hookway', 'age': 61, 'title': 'Chief Operating Officer of Global Business Services & Information Technology and Systems', 'yearBorn': 1961, 'fiscalYear': 2022, 'exercisedValue': 0, 'unexercisedValue': 0}, {'maxAge': 1, 'name': 'Dr. Helmut  Schuster', 'age': 61, 'title': 'Advisor', 'yearBorn': 1961, 'fiscalYear': 2022, 'exercisedValue': 0, 'unexercisedValue': 0}]	5.0	1.0	5.0	9.0	3.0	1696118400.0	1672444800.0	86400	2	555.0	553.2	553.2	561.3	555.0	553.2	553.2	561.3	0.22	0.0388	1691625600.0	0.2533	6.16	0.62	6.91358	682.9268	3962657	3962657	37610341	39236321	39236321	559.9	560.1	0.0	0.0	95639044096.0	445.5	570.567	0.42023072	506.378	498.47974	0.265	0.00047747744	GBp	143634972672.0	0.081949994	17126163477.0	17078400000.0	0.00252	0.39976	17078400000.0	4.014	139.51172	1672444800.0	1703980800.0	1688083200.0	-0.806	18648999936.0	0.81	0.82	-7.27	2:1	938995200.0	0.631	2.809	0.20593083	0.18349409	5.732	1691625600.0	LSE	EQUITY	BP.L	BP.L	BP PLC $0.25	BP p.l.c.	583743600	Europe/London	BST	f367e74b-06ae-3c13-9f8a-f5b4b43b117c	finmb_394466	3600000	560.0	9.99	4.9	6.09	5.77	2.0	buy	20.0	29585000448.0	1.688	51136000000.0	60699000832.0	0.711	1.17	227586998272.0	70.908	12.563	0.08392999	0.23392001	70171000000.0	27843749888.0	35774001152.0	-0.788	-0.284	0.29895002	0.22469	0.09852	USD		0.01761323407006779	0.27960142279781625	GB0007980591																		
Hangar 89	Luton	LU2 9PF	United Kingdom	44 1582 525 019		https://www.easyjet.com	Airlines	airlines	Airlines	Industrials	industrials	Industrials	easyJet plc operates as a low-cost airline carrier in Europe. It also engages in the sale of holiday packages; aircraft trading and leasing; development of building projects; financing and insurance business; and tour operator activities. As of September 30, 2022, it operated 320 aircrafts, 988 routes, and 153 airports. easyJet plc was founded in 1995 and is based in Luton, the United Kingdom.	14443.0	[{'maxAge': 1, 'name': 'Mr. Johan Peter Lundgren', 'age': 56, 'title': 'CEO & Director', 'yearBorn': 1966, 'fiscalYear': 2022, 'totalPay': 2034000, 'exercisedValue': 0, 'unexercisedValue': 0}, {'maxAge': 1, 'name': 'Mr. Kenton  Jarvis', 'age': 54, 'title': 'CFO & Director', 'yearBorn': 1968, 'fiscalYear': 2022, 'totalPay': 1598000, 'exercisedValue': 0, 'unexercisedValue': 0}, {'maxAge': 1, 'name': 'Mr. David  Morgan', 'age': 57, 'title': 'Chief Operating Officer', 'yearBorn': 1965, 'exercisedValue': 0, 'unexercisedValue': 0}, {'maxAge': 1, 'name': 'Mr. Stuart  Birrell', 'title': 'Chief Data & Information Officer', 'exercisedValue': 0, 'unexercisedValue': 0}, {'maxAge': 1, 'name': 'Mr. Andrew  Barker', 'age': 57, 'title': 'Director of Investor Relations', 'yearBorn': 1965, 'exercisedValue': 0, 'unexercisedValue': 0}, {'maxAge': 1, 'name': 'Ms. Rebecca  Mills', 'title': 'Group Gen. Counsel', 'exercisedValue': 0, 'unexercisedValue': 0}, {'maxAge': 1, 'name': 'Mr. Robert M. Birge', 'age': 52, 'title': 'Chief Customer & Marketing Officer', 'yearBorn': 1970, 'exercisedValue': 0, 'unexercisedValue': 0}, {'maxAge': 1, 'name': 'Ms. Jane  Storm', 'title': 'Group People Director', 'exercisedValue': 0, 'unexercisedValue': 0}, {'maxAge': 1, 'name': 'Ms. Sophie  Dekkers', 'title': 'Chief Commercial Officer', 'exercisedValue': 0, 'unexercisedValue': 0}, {'maxAge': 1, 'name': 'Mr. Garry  Wilson', 'title': 'Chief Exec. Officer of easyJet Holidays', 'exercisedValue': 0, 'unexercisedValue': 0}]	3.0	1.0	8.0	1.0	3.0	1696118400.0	1672444800.0	86400	2	390.6	382.7	376.5	392.6001	390.6	382.7	376.5	392.6001			1582761600.0	0.0		2.506493		6.8222303	788256	788256	4907661	7058739	7058739	383.0	383.5	0.0	0.0	3171041024.0	308.2	582.709	0.45560935	430.126	469.3945	0.0	0.0	GBp	3098417920.0	-0.0064600003	617449670.0	758000000.0	0.16261	0.4018	827948032.0	2.558	149.72635	1664496000.0	1696032000.0	1680220800.0		-45000000.0	-0.06	56.14	0.09	11:12	1330905600.0	0.445	13.241	0.19269407	0.18349409	43.9	1582761600.0	LSE	EQUITY	EZJ.L	EZJ.L	EASYJET PLC ORD 27 2/7P	easyJet plc	974275200	Europe/London	BST	9dd3468d-a5b6-32b7-b751-274c881a793e	finmb_2089681	3600000	383.0	875.0	450.0	639.47	600.0	2.5	buy	19.0	3486000128.0	4.642	234000000.0	3641999872.0	0.769	0.949	6960000000.0	189.589	9.261	0.00509	-0.020639999	1365000000.0	937500032.0	1302000000.0		0.795	0.24510999	0.03362	0.012209999	GBP		0.024200029999167642	0.3841635665886013	GB00B7KR2P84	London Luton Airport																	
Baarermattstrasse 3	Baar	CH-6340	Switzerland	41 41 709 2000	41 41 709 3000	https://www.glencore.com	Other Industrial Metals & Mining	other-industrial-metals-mining	Other Industrial Metals & Mining	Basic Materials	basic-materials	Basic Materials	Glencore plc engages in the production, refinement, processing, storage, transport, and marketing of metals and minerals, and energy products in the Americas, Europe, Asia, Africa, and Oceania. It operates through two segments: Marketing Activities and Industrial Activities. The company engages in production and marketing copper, cobalt, nickel, zinc, lead, chrome ore, ferrochrome, vanadium, aluminum, alumina, and iron ore; and coal, crude oil, refined products, and natural gas, as well as oil exploration/production and refining/distribution. It also operates marketing and distribution of physical commodities sourced from third party producers and company's production to industrial consumers, including the battery, electronic, construction, automotive, steel, energy, and oil industries. In addition, the company provides financing, logistics, and other services to producers and consumers of commodities. Glencore plc was founded in 1974 and is headquartered in Baar, Switzerland.	140000.0	[{'maxAge': 1, 'name': 'Mr. Gary  Nagle', 'age': 47, 'title': 'CEO & Director', 'yearBorn': 1975, 'fiscalYear': 2022, 'totalPay': 6071000, 'exercisedValue': 0, 'unexercisedValue': 0}, {'maxAge': 1, 'name': 'Mr. Steven  Kalmin', 'age': 51, 'title': 'Chief Financial Officer', 'yearBorn': 1971, 'fiscalYear': 2013, 'exercisedValue': 0, 'unexercisedValue': 0}, {'maxAge': 1, 'name': 'Mr. Martin  Fewings', 'title': 'Head of Investor Relations & Communications', 'exercisedValue': 0, 'unexercisedValue': 0}, {'maxAge': 1, 'name': 'Shaun  Teichner', 'title': 'Gen. Counsel', 'exercisedValue': 0, 'unexercisedValue': 0}, {'maxAge': 1, 'name': 'Mr. Dawid  Myburgh', 'title': 'Chief Geologist', 'exercisedValue': 0, 'unexercisedValue': 0}, {'maxAge': 1, 'name': 'Dr. Michael  Fahrbach', 'title': 'Head of Sustainability', 'exercisedValue': 0, 'unexercisedValue': 0}, {'maxAge': 1, 'name': 'Mr. Peter Carl Freyberg', 'age': 63, 'title': 'Head of Industrial Assets', 'yearBorn': 1959, 'exercisedValue': 0, 'unexercisedValue': 0}, {'maxAge': 1, 'name': 'Japie  Fullard', 'title': 'Head of Ferroalloys Assets', 'exercisedValue': 0, 'unexercisedValue': 0}, {'maxAge': 1, 'name': 'Jason  Kluk', 'title': 'Head of Ferroalloys & Nickel Marketing', 'exercisedValue': 0, 'unexercisedValue': 0}, {'maxAge': 1, 'name': 'Ruan  Van Schalkwyk', 'title': 'Head of Coal Marketing', 'exercisedValue': 0, 'unexercisedValue': 0}]	10.0	1.0	9.0	1.0	9.0	1696118400.0	1672444800.0	86400	2	462.85	462.15	458.05	464.1398	462.85	462.15	458.05	464.1398	0.35	0.0762	1693440000.0	0.4653		1.320473	7.4774127	909.01886	3047099	3047099	32312217	34299211	34299211	463.5	463.6	0.0	0.0	57108516864.0	106.98	584.5	0.24942137	442.897	467.99924	0.44	0.0009506319	GBp	80248692736.0	0.04281	10110972998.0	12318499840.0	0.10086001	0.46215	12318499840.0	3.683	125.875534	1672444800.0	1703980800.0	1688083200.0	-0.622	9802999808.0	0.62	0.51	-0.61			0.35	3.727	-0.021670163	0.18349409	6.412	1693440000.0	LSE	EQUITY	GLEN.L	GLEN.L	GLENCORE PLC ORD USD0.01	Glencore plc	1305788400	Europe/London	BST	e1e02e8d-9754-3105-be31-fd46fc52b37a	finmb_704674	3600000	463.5996	6.11	5.01	5.5	5.51	1.7	buy	10.0	1892999936.0	0.153	21531000832.0	29244000256.0	0.32	1.347	228964007936.0	71.027	17.942	0.07146	0.20284		7478750208.0	13936000000.0	-0.609	-0.201	0.07882	0.09404001	0.06534	USD		0.020208973150690576	0.3208075032522522	JE00B4T3BW64																		
Turner House	Slough	SL1 3UH	United Kingdom	44 17 5321 7800		https://www.reckitt.com	Household & Personal Products	household-personal-products	Household & Personal Products	Consumer Defensive	consumer-defensive	Consumer Defensive	Reckitt Benckiser Group plc manufactures and sells health, hygiene, and nutrition products worldwide. It offers acne treatment creams, facial washes, and cleansing pads; germ protection products; condoms; heartburn and indigestion solutions; joints health products; chest congestion, cough, and sinus remedies; vaginal care routine products; sore throat medications; and hair removal products under the Clearasil, Dettol, Durex, Gaviscon, Nurofen, Mucinex, Queen V, Strepsils, and Veet brands. The company also offers fragrances and devices; water softeners; home cleaning products; dish washes; toilet cleaners; disinfectants; sprays, baits, and plug-ins for pest control; stain removals; fabric washing; and other hygiene products under the Air Wick, Calgon, Cillit Bang, Finish, Harpic, Lysol, Mortein, Vanish, and Woolite brands. In addition, it provides vitamins, minerals, and supplements under the Biofreeze, Airborne, Mead Johnson, Move Free, Enfamil, Neuriva, and Nutramigen brands. The company was founded in 1819 and is headquartered in Slough, the United Kingdom.	40000.0	"[{'maxAge': 1, 'name': 'Mr. Jeffrey  Carr ACMA, B.Eng', 'age': 61, 'title': 'Group CFO & Executive Director', 'yearBorn': 1961, 'fiscalYear': 2022, 'totalPay': 3383887, 'exercisedValue': 0, 'unexercisedValue': 0}, {'maxAge': 1, 'name': 'Mr. Kris  Licht', 'age': 45, 'title': 'CEO & Executive Director', 'yearBorn': 1977, 'fiscalYear': 2022, 'exercisedValue': 0, 'unexercisedValue': 0}, {'maxAge': 1, 'name': 'Mr. Filippo  Catalano', 'age': 49, 'title': 'Chief Information & Digitisation Officer', 'yearBorn': 1973, 'fiscalYear': 2022, 'exercisedValue': 0, 'unexercisedValue': 0}, {'maxAge': 1, 'name': 'Mr. Richard  Joyce', 'title': 'Head of Investor Relations', 'fiscalYear': 2022, 'exercisedValue': 0, 'unexercisedValue': 0}, {'maxAge': 1, 'name': ""Ms. Catheryn  O'Rourke"", 'age': 49, 'title': 'Senior VP, General Counsel & Company Secretary', 'yearBorn': 1973, 'fiscalYear': 2022, 'exercisedValue': 0, 'unexercisedValue': 0}, {'maxAge': 1, 'name': 'Mr. Fabrice  Beaulieu', 'age': 48, 'title': 'Chief Marketing, Sustainability & Corporate Affairs Officer', 'yearBorn': 1974, 'fiscalYear': 2022, 'exercisedValue': 0, 'unexercisedValue': 0}, {'maxAge': 1, 'name': 'Mr. Ranjay  Radhakrishnan', 'age': 51, 'title': 'Chief Human Resources Officer', 'yearBorn': 1971, 'fiscalYear': 2022, 'exercisedValue': 0, 'unexercisedValue': 0}, {'maxAge': 1, 'name': 'Mr. John  Dawson', 'title': 'Senior Vice President of Investor Relations', 'fiscalYear': 2022, 'exercisedValue': 0, 'unexercisedValue': 0}, {'maxAge': 1, 'name': 'Mr. Sami  Naffakh', 'age': 51, 'title': 'Chief Supply Officer', 'yearBorn': 1971, 'fiscalYear': 2022, 'exercisedValue': 0, 'unexercisedValue': 0}, {'maxAge': 1, 'name': 'Mr. Volker  Kuhn', 'age': 54, 'title': 'President of Hygiene', 'yearBorn': 1968, 'fiscalYear': 2022, 'exercisedValue': 0, 'unexercisedValue': 0}]"	3.0	5.0	3.0	1.0	3.0	1696118400.0	1672444800.0	86400	2	5852.0	0.0	0.0	0.0	5852.0	0.0	0.0	0.0	1.87	0.0319	1691020800.0	0.59220004	2.81	0.086	18.883871	16.231354	29835	29835	1590651	1299996	1299996	0.0	0.0			42008887296.0	0.0	6570.0	2.79854	5755.84	5951.28	1.869	0.00031937798	GBp	49640980480.0	0.14822	712802214.0	717609984.0	0.0008	0.64182	717609984.0	12.804	457.20087	1672444800.0	1703980800.0	1688083200.0	-0.078	2223000064.0	3.1	360.66	4.38			3.307	13.057	0.0048060417	0.18349409	76.6	1691020800.0	LSE	EQUITY	RKT.L	RKT.L	RECKITT BENCKISER GROUP PLC ORD	Reckitt Benckiser Group plc	583743600	Europe/London	BST	b4498632-9091-3f60-a3c5-f04d3e4dbfe4	finmb_874480	3600000	5854.0	7800.0	5900.0	6974.44	7085.0	2.2	buy	18.0	1027000000.0	1.431	3801999872.0	8643999744.0	0.352	0.54	15011000320.0	93.875	20.963	0.075679995	0.24675	8361000000.0	2502749952.0	2495000064.0	-0.08	0.081	0.58497	0.25327998	0.23556	GBP	4.6009	0.009803018507264734	0.1556180944079167	GB00B24CGK77	103-105 Bath Road																	
